,img_id,number,title,category_big,category_mid,price,detail,region,status,file_count,url
1255,150738283,1,한두번착용) 블랙후드티,여성의류,맨투맨_후드티,"5,000원","사이즈 free 검정색총길이 70 (후드 미포함) 가슴56사진 보시면 물빠진거처럼 나오는데 실제로보면 물빠짐 없이 검은색입니다착용도 딱히 안하고 잠깐잠깐 입은게다라 깨끗합니다아랫글 읽으시고 문의주세요 _정왕본동예약 해달라하고 잠수타는분들 많아서 예약 안걸어둡니다만나서 에눌해달라하시는분들 많으신데 안해드려요 모든금액은 채팅으로 정한후 거래합니다새제품, 중고 모두 교환 환불 절대 불가가전제품도 미개봉 새제품일경우 구매해가시고 고장이여도 교환,환불 절대 불가입니다직거래 가능 (평일은 퇴근후 저녁7시부터 가능)정왕본동 2294-7 세븐일레븐 정왕마유로점 편의점 앞에서 직거래합니다. 가지러 오셔야해요 가져다 드리지 않습니다.택배 거래 가능 / 반값택배 가능 (GS편의점 이용)택배비 말씀 없으시면 착불로 보내드리고선불시 최소 3500원부터 무게추가시 가격 추가해서 받습니다반값택배는 배송비 2000원부터 받습니다 무조건 선불(택배거래시 배송 중 파손되도 교환 환불 불가)전화번호는 따로 안알려드리며 채팅으로만 거래합니다불안하고 찝찝하고 의심하실거면 구매하시지 말아주세요~",경기도 시흥시 정왕본동,중고,3,https://m.bunjang.co.kr/products/150738283?ref=%EC%B9%B4%ED%85%8C%EA%B3%A0%EB%A6%AC%EC%84%A0%ED%83%9D%EA%B2%B0%EA%B3%BC
1256,150740050,1,나이키 후드,여성의류,맨투맨_후드티,"40,000원",나이키 후드집업 정품 1회시착상태최상남자 s사이즈90여자인 제가 입으려고 샀는데조금 커서 내노아요~루즈하게 레깅스에 입기 좋아요,충청북도 청주시 흥덕구 봉명1동,중고,1,https://m.bunjang.co.kr/products/150740050?ref=%EC%B9%B4%ED%85%8C%EA%B3%A0%EB%A6%AC%EC%84%A0%ED%83%9D%EA%B2%B0%EA%B3%BC
1257,150745748,1,오아이오아이.디네댓.아웃도어 맨투맨후드 oioi,여성의류,맨투맨_후드티,"15,000원",하자 x,전국,중고,4,https://m.bunjang.co.kr/products/150745748?ref=%EC%B9%B4%ED%85%8C%EA%B3%A0%EB%A6%AC%EC%84%A0%ED%83%9D%EA%B2%B0%EA%B3%BC
1258,150749589,1,"아디다스 x JKOO 러플 프릴 셋업, 후드 스커트",여성의류,맨투맨_후드티,"50,000원","adidas와 JKOO 의 콜라보 후드, 스커트 셋업입니다. 프릴 러플 디테일이 이뻐요후드는 허리부분 스트링으로 러플을 잡고 사이즈조절 가능합니다.오프라인으로 각각 12만원. 총 24만원에 구입 했습니다5만원 , 셋업으로 구매 시 9.5만원으로 판매합니다.상태 A사이즈 표기 S (실측 L) 착용자 사이즈 : 키 168, 55사이즈후드와 스커트 둘다 66까지 ,맞을 것 같음각각 50,000원에 판매 , 셋업으로 구매 시 95,000원.",충청북도 충주시 호암.직동,중고,10,https://m.bunjang.co.kr/products/150749589?ref=%EC%B9%B4%ED%85%8C%EA%B3%A0%EB%A6%AC%EC%84%A0%ED%83%9D%EA%B2%B0%EA%B3%BC
1259,150750892,1,마크골잘레스 맨투맨 하늘색,여성의류,맨투맨_후드티,"49,000원",구하기 어려운 마크곤잘레스 맨투맨 하늘색입니다봄에 입기 딱좋고 오버핏으로도 아주 좋아요사이즈L,서울특별시 서초구 양재1동,중고,4,https://m.bunjang.co.kr/products/150750892?ref=%EC%B9%B4%ED%85%8C%EA%B3%A0%EB%A6%AC%EC%84%A0%ED%83%9D%EA%B2%B0%EA%B3%BC
1260,150753219,1,크롭 집업,여성의류,맨투맨_후드티,"10,000원",안입어서 내놉니다 싸게 사가세요,대전광역시 서구 복수동,중고,1,https://m.bunjang.co.kr/products/150753219?ref=%EC%B9%B4%ED%85%8C%EA%B3%A0%EB%A6%AC%EC%84%A0%ED%83%9D%EA%B2%B0%EA%B3%BC
1261,150757151,1,캐릭터 긴팔 맨투맨 그린 색상 M 사이즈,여성의류,맨투맨_후드티,"7,500원",귀여운 캐릭터가 프린팅 된 맨투맨티입니당~~ (2003)색상 : 그린사이즈 : M총기장 : 66가슴 : 118어깨 : 60 소매 : 50,서울특별시 동대문구 장안동,새상품,3,https://m.bunjang.co.kr/products/150757151?ref=%EC%B9%B4%ED%85%8C%EA%B3%A0%EB%A6%AC%EC%84%A0%ED%83%9D%EA%B2%B0%EA%B3%BC
1262,150776733,1,후아유 후드집업,여성의류,맨투맨_후드티,"15,000원",교복 위에 입으면 예뻐요상태 좋음연한 분홍색지금 입기 딱 좋아요 쿨거시 택포 17000,전국,중고,1,https://m.bunjang.co.kr/products/150776733?ref=%EC%B9%B4%ED%85%8C%EA%B3%A0%EB%A6%AC%EC%84%A0%ED%83%9D%EA%B2%B0%EA%B3%BC
1263,150778211,1,새상품) 언발 기모 맨투맨,여성의류,맨투맨_후드티,"7,000원",사이즈 FREE,전국,중고,1,https://m.bunjang.co.kr/products/150778211?ref=%EC%B9%B4%ED%85%8C%EA%B3%A0%EB%A6%AC%EC%84%A0%ED%83%9D%EA%B2%B0%EA%B3%BC
1264,150781453,1,네이키드니스 후드티,여성의류,맨투맨_후드티,"10,000원",지금은 판매하지 않는 네이키드니스 후드티 입니다!넘 예쁜 브라운 후드티에요!속에 기모가 들어있어서 요즘같은 환절기에 입기 좋아요사이즈는 Free 입니다!중고 상품이라 엄청 저렴하게 내놔요 원가는 69000원 입니다!보풀이나 큰 하자는 존재하지 않지만 입었던 거라 미세한 생활 하자는 존재할 수 있어요ㅜㅜ요 점 참고해주세요,서울특별시 구로구 개봉제3동,중고,3,https://m.bunjang.co.kr/products/150781453?ref=%EC%B9%B4%ED%85%8C%EA%B3%A0%EB%A6%AC%EC%84%A0%ED%83%9D%EA%B2%B0%EA%B3%BC
1265,150784131,1,데일리룩 면티,여성의류,맨투맨_후드티,"5,000원",새거에요 가슴둘레90이니 77도 가능,강원도 강릉시 사천면,중고,2,https://m.bunjang.co.kr/products/150784131?ref=%EC%B9%B4%ED%85%8C%EA%B3%A0%EB%A6%AC%EC%84%A0%ED%83%9D%EA%B2%B0%EA%B3%BC
1266,150785900,1,맨투맨 - 빨강,여성의류,맨투맨_후드티,"10,000원",어깨 45기장 70팔길이70 정도입니다 정확하지는 않으니 길이는 참고로 봐주세요인터넷으로 주문했으나 신장에 비해 너무 커서 한두번 겜방갈때만 입고 걸어놨습니다,충청북도 청주시 서원구 모충동,중고,1,https://m.bunjang.co.kr/products/150785900?ref=%EC%B9%B4%ED%85%8C%EA%B3%A0%EB%A6%AC%EC%84%A0%ED%83%9D%EA%B2%B0%EA%B3%BC
1267,150787846,1,아메카지 후드집업,여성의류,맨투맨_후드티,"15,000원",재작년쯤 후아유 매장에서 구매한 제품입니당안감이 체크무늬라서 유니크하고 귀여워요전체적으로 흐물거리지않는 탄탄한 재질이에요!이외에 궁금하신 점은 번톡주세요 :),경기도 오산시 중앙동,중고,5,https://m.bunjang.co.kr/products/150787846?ref=%EC%B9%B4%ED%85%8C%EA%B3%A0%EB%A6%AC%EC%84%A0%ED%83%9D%EA%B2%B0%EA%B3%BC
1268,150793189,1,베이프 여성집업후드카모,여성의류,맨투맨_후드티,"180,000원",베이프여성후드집업 카모색상 정말 예뻐요.작아서 못입고 아끼다 내놓아요기모없이 기본적인 두께감이에요.가슴단면 42cm 총장57cm사용감 별로 없어요택보면 깨끗합니다18만원직거래 좋고택배요금 3천원있습니다.​,경기도 수원시 권선구 권선2동,중고,8,https://m.bunjang.co.kr/products/150793189?ref=%EC%B9%B4%ED%85%8C%EA%B3%A0%EB%A6%AC%EC%84%A0%ED%83%9D%EA%B2%B0%EA%B3%BC
1269,150805281,1,키르시 아이보리 맨투맨 팔아요,여성의류,맨투맨_후드티,"30,000원",오염이나 하자는 없어요 상태 좋아요 ,전라남도 목포시 용해동,중고,2,https://m.bunjang.co.kr/products/150805281?ref=%EC%B9%B4%ED%85%8C%EA%B3%A0%EB%A6%AC%EC%84%A0%ED%83%9D%EA%B2%B0%EA%B3%BC
1270,150807566,1,MLB 양털,여성의류,맨투맨_후드티,"65,000원",급처라서 싸게 내놨어요 딱 한번 입은 새상품입니다M 사이즈 입니다 남녀공용 이고 오버핏입니다 ,전국,새상품,1,https://m.bunjang.co.kr/products/150807566?ref=%EC%B9%B4%ED%85%8C%EA%B3%A0%EB%A6%AC%EC%84%A0%ED%83%9D%EA%B2%B0%EA%B3%BC
1271,150832914,1,"스파오 울프죠 후드집업 그레이 (모자털 O, 핑크만 남음)",여성의류,맨투맨_후드티,"15,000원","그레이 M (상태좋음, 모자털 O) - 팔림❌핑크 L (사용감있음, 모자털 X) - 택포 15,000₩중고특성상 컴플레인 절대절대 안받음",전국,중고,4,https://m.bunjang.co.kr/products/150832914?ref=%EC%B9%B4%ED%85%8C%EA%B3%A0%EB%A6%AC%EC%84%A0%ED%83%9D%EA%B2%B0%EA%B3%BC
1272,150838338,1,보틀 맨투맨,여성의류,맨투맨_후드티,"9,000원",삼만원대 구입앞 부분에 얼룩 있어서 싸게 팔아요드라이 맡기시면 바로 지워집니다!,대전광역시 대덕구 석봉동,중고,3,https://m.bunjang.co.kr/products/150838338?ref=%EC%B9%B4%ED%85%8C%EA%B3%A0%EB%A6%AC%EC%84%A0%ED%83%9D%EA%B2%B0%EA%B3%BC
1273,150839084,1,해브어굿타임 후드티,여성의류,맨투맨_후드티,"30,000원",구매하시면 깨끗하게 세탁해서 보내드립니다!!흰색에 파란색 조합 예쁜 거 아시죠!!사이즈는 M입니당,전국,중고,3,https://m.bunjang.co.kr/products/150839084?ref=%EC%B9%B4%ED%85%8C%EA%B3%A0%EB%A6%AC%EC%84%A0%ED%83%9D%EA%B2%B0%EA%B3%BC
1274,150839506,1,키르시 후드티,여성의류,맨투맨_후드티,"30,000원",저처럼 빨간색 좋아하시고 귀여운 거 좋아하시는 분 무조건 사세요!색감 너무 미쳤습니당ㅠㅠ원가 주고 샀어용,전국,중고,4,https://m.bunjang.co.kr/products/150839506?ref=%EC%B9%B4%ED%85%8C%EA%B3%A0%EB%A6%AC%EC%84%A0%ED%83%9D%EA%B2%B0%EA%B3%BC
1275,150848572,1,후아유 울프죠,여성의류,맨투맨_후드티,"1,000원",연락주세용 천원아님,경기도 파주시 운정3동,중고,1,https://m.bunjang.co.kr/products/150848572?ref=%EC%B9%B4%ED%85%8C%EA%B3%A0%EB%A6%AC%EC%84%A0%ED%83%9D%EA%B2%B0%EA%B3%BC
1276,150874262,1,탠저 오프숄더 그레이,여성의류,맨투맨_후드티,"40,000원",시착1회 상태 좋아요그레이 착샷이뻐서 세트로 같이 산거에요,서울특별시 영등포구 신길제1동,새상품,2,https://m.bunjang.co.kr/products/150874262?ref=%EC%B9%B4%ED%85%8C%EA%B3%A0%EB%A6%AC%EC%84%A0%ED%83%9D%EA%B2%B0%EA%B3%BC
1277,150875002,1,아이앱스튜디오 피그먼트 후드,여성의류,맨투맨_후드티,0원,아이앱스튜오 블럭피그먼트후드 S사이즈새상품,경기도 안산시 단원구 와동,중고,2,https://m.bunjang.co.kr/products/150875002?ref=%EC%B9%B4%ED%85%8C%EA%B3%A0%EB%A6%AC%EC%84%A0%ED%83%9D%EA%B2%B0%EA%B3%BC
1278,150886137,1,폴로 니트집업,여성의류,맨투맨_후드티,"48,000원",M사이즈입니당브라운 밤색입니당,전국,중고,3,https://m.bunjang.co.kr/products/150886137?ref=%EC%B9%B4%ED%85%8C%EA%B3%A0%EB%A6%AC%EC%84%A0%ED%83%9D%EA%B2%B0%EA%B3%BC
1279,150886187,1,나이키 맨투맨 후드티 티셔츠 스우시,여성의류,맨투맨_후드티,"20,000원","여자S구요 상세사이즈 나와있어요~사고 사이즈 불편해서 한번도 안입고 나갔어요 교환하기엔 이미 택도 다 땟고 해서 옷장에 오래 방치하다가 드디어 팔아봅니다,,,",경상북도 경산시 동부동,새상품,3,https://m.bunjang.co.kr/products/150886187?ref=%EC%B9%B4%ED%85%8C%EA%B3%A0%EB%A6%AC%EC%84%A0%ED%83%9D%EA%B2%B0%EA%B3%BC
1280,150890979,1,회색 맨투맨,여성의류,맨투맨_후드티,"8,000원",회색 맨투맨입니다 ㅎㅎ착용감 거의없어 상태 너무 좋아요캐주얼하게 입을수 있어요~편의점 반값택배 +1500일반택배 +2000,경기도 성남시 분당구 이매2동,중고,1,https://m.bunjang.co.kr/products/150890979?ref=%EC%B9%B4%ED%85%8C%EA%B3%A0%EB%A6%AC%EC%84%A0%ED%83%9D%EA%B2%B0%EA%B3%BC
1281,150910649,1,(새상품)코드유 후드티셔츠,여성의류,맨투맨_후드티,"50,000원",코드유 후드티셔츠 입니다택 부착되어있는 한번도 착용하지않은 새상품입니다교환환불 불가하며 구매할실분만 연락주세요무료배송으로 보내드립니다,경기도 수원시 장안구 조원2동,새상품,2,https://m.bunjang.co.kr/products/150910649?ref=%EC%B9%B4%ED%85%8C%EA%B3%A0%EB%A6%AC%EC%84%A0%ED%83%9D%EA%B2%B0%EA%B3%BC
1282,150911479,1,(새상품)샵마그넷 카인드니트후드,여성의류,맨투맨_후드티,"74,000원",샵마그넷 카인드니트후드입니다한번도 착용하지 않은 새상품입니다저한텐 안어울리는것같아 판매해요ㅠㅠ교환환불 불가하며 구매할실분만 연락주세요배송비 별도입니다,경기도 수원시 장안구 조원2동,새상품,2,https://m.bunjang.co.kr/products/150911479?ref=%EC%B9%B4%ED%85%8C%EA%B3%A0%EB%A6%AC%EC%84%A0%ED%83%9D%EA%B2%B0%EA%B3%BC
1283,150920945,1,골지 지퍼 후드집업,여성의류,맨투맨_후드티,"8,000원","두번입고 팜 아까워죽겠네두개 한번에 구매하면 17000에 해드림블랙, 그레이 있음반값택배+1600일반택배 번톡ㄱ",전국,중고,1,https://m.bunjang.co.kr/products/150920945?ref=%EC%B9%B4%ED%85%8C%EA%B3%A0%EB%A6%AC%EC%84%A0%ED%83%9D%EA%B2%B0%EA%B3%BC
1284,150925145,1,아미 여성 맨투맨 새상품,여성의류,맨투맨_후드티,"30,000원",새상품입니다레플리카입니다기장길이 67,서울특별시 광진구 자양제3동,중고,3,https://m.bunjang.co.kr/products/150925145?ref=%EC%B9%B4%ED%85%8C%EA%B3%A0%EB%A6%AC%EC%84%A0%ED%83%9D%EA%B2%B0%EA%B3%BC
1285,150932101,1,헤지스x피터젠슨 여성 맨투맨 95,여성의류,맨투맨_후드티,"35,000원",헤지스X피터젠슨 콜라보 여성 맨투맨사이즈: 95 어깨:41cm/ 가슴47cm 팔:57cm /  기장 51cm *기장감이 살짝 짧은 제품이니 꼭 실측을 확인해주세용가격: 택포 35000원상태 하자없이 좋습니다 ^^,서울특별시 동작구 사당제1동,중고,7,https://m.bunjang.co.kr/products/150932101?ref=%EC%B9%B4%ED%85%8C%EA%B3%A0%EB%A6%AC%EC%84%A0%ED%83%9D%EA%B2%B0%EA%B3%BC
1286,150932251,1,A.P.C 아페쎄 클래식 로고 맨투맨 (파란색 blue),여성의류,맨투맨_후드티,"146,000원","아페쎄 클래식 로고 맨투맨제가 위키미키 김도연 팬이라 ,, 인스타에 올린 거 보고무턱대고 꽂혀서 샀는데 컬러가 저에게는 별로어울리지 않아서 한번도 입고 나가지 못 했어요 ㅠ ㅠ 신세계 백화점에서 33만원에 샀는데,(아페쎄 공홈이나 해외구매대행 가격도 이 제품은33만원 이상입니다! 특히 파란색은 품절 ,,)택은 바로 뗀 제품이지만 대신 쇼핑백은 그대로 있습니다필요하시다면 쇼핑백 같이 보내드릴 수 있어요 ~~ 아예 새 제품인데 택만 없어서 가격 낮춰 올려봅니다!파란색 blue - s사이즈이구요사진이랑 색도 핏도 똑같고 예쁜데 묵혀두고 있기가 아까워서 ,,원하시면 인증 사진도 세부 사진도 다 가능해요!일산이나 서울 사시면 상의 하에 직거래도 가능하구요.문의 편하게 주세요 ~~",경기도 고양시 덕양구 행신3동,새상품,2,https://m.bunjang.co.kr/products/150932251?ref=%EC%B9%B4%ED%85%8C%EA%B3%A0%EB%A6%AC%EC%84%A0%ED%83%9D%EA%B2%B0%EA%B3%BC
1287,150936225,1,키르시 체리 맨투맨,여성의류,맨투맨_후드티,"25,000원","키르시 체리 맨투맨 LF몰에서 59,000원으로 구매했는데안 입어서 25,000원으로 판매합니다!택배+4000",전국,중고,1,https://m.bunjang.co.kr/products/150936225?ref=%EC%B9%B4%ED%85%8C%EA%B3%A0%EB%A6%AC%EC%84%A0%ED%83%9D%EA%B2%B0%EA%B3%BC
1288,150937984,1,크로스드레슬리 후드,여성의류,맨투맨_후드티,"16,000원",번장에서 하자 없다고 구매한건데 군데군데 사용감이 있어서 ㅜㅜ두번정도입고 판매하신 제품이랍니다.쿨거 하실 분만 연락 주세요(찔러보기 자제),부산광역시 연제구 연산제4동,중고,4,https://m.bunjang.co.kr/products/150937984?ref=%EC%B9%B4%ED%85%8C%EA%B3%A0%EB%A6%AC%EC%84%A0%ED%83%9D%EA%B2%B0%EA%B3%BC
1289,150946342,1,고고은별 마켓 맨투맨,여성의류,맨투맨_후드티,"22,000원",1회착용,서울특별시 구로구 고척제1동,중고,4,https://m.bunjang.co.kr/products/150946342?ref=%EC%B9%B4%ED%85%8C%EA%B3%A0%EB%A6%AC%EC%84%A0%ED%83%9D%EA%B2%B0%EA%B3%BC
1290,150953209,1,엠블러 테디 오버핏 기모 스웨트셔츠 M 곰돌이맨투맨 기모자수,여성의류,맨투맨_후드티,"25,000원",네이비 M 색상입니다 지금 네이비는 다 품절된것 같아요한번 입었어요 편하게 연락주세요!,광주광역시 동구 학운동,중고,4,https://m.bunjang.co.kr/products/150953209?ref=%EC%B9%B4%ED%85%8C%EA%B3%A0%EB%A6%AC%EC%84%A0%ED%83%9D%EA%B2%B0%EA%B3%BC
1291,150955415,1,oioi 맨투맨,여성의류,맨투맨_후드티,"35,000원",오아이오아이 맨투맨 네이비 색상 입니다 !비닐 그대로 있는 완정한 새상품 이고 사이즈는 L입니다 !원가 : 59000쿨거시 가격 내려드려요 편히 번톡 주세요😊,전국,새상품,3,https://m.bunjang.co.kr/products/150955415?ref=%EC%B9%B4%ED%85%8C%EA%B3%A0%EB%A6%AC%EC%84%A0%ED%83%9D%EA%B2%B0%EA%B3%BC
1292,150959719,1,마하그리드 맨투맨,여성의류,맨투맨_후드티,"10,000원",,경기도 광명시 철산3동,중고,2,https://m.bunjang.co.kr/products/150959719?ref=%EC%B9%B4%ED%85%8C%EA%B3%A0%EB%A6%AC%EC%84%A0%ED%83%9D%EA%B2%B0%EA%B3%BC
1293,150961760,1,정품) 메종키츠네 맨투맨,여성의류,맨투맨_후드티,"150,000원",남성 s사이즈입니다택 사진은 구입했을때 사진입니다몇번 안입어서 상태 좋고 하자도 없습니다!가격 내려서 택포 15만원이요!,경기도 시흥시 능곡동,중고,3,https://m.bunjang.co.kr/products/150961760?ref=%EC%B9%B4%ED%85%8C%EA%B3%A0%EB%A6%AC%EC%84%A0%ED%83%9D%EA%B2%B0%EA%B3%BC
1294,150964853,1,1987후드티,여성의류,맨투맨_후드티,"40,000원",3번정도 입은 상품으로 하자는 없습니다!!,전국,중고,5,https://m.bunjang.co.kr/products/150964853?ref=%EC%B9%B4%ED%85%8C%EA%B3%A0%EB%A6%AC%EC%84%A0%ED%83%9D%EA%B2%B0%EA%B3%BC
1295,150971639,1,맥앤칩스 후드티,여성의류,맨투맨_후드티,"35,000원",안에 기모 얇게 깔려있어요162기준 레깅스랑 입기 좋은 기장입니다오염하자늘어짐없이 세탁 후 보관중이에요,대전광역시 중구 용두동,중고,3,https://m.bunjang.co.kr/products/150971639?ref=%EC%B9%B4%ED%85%8C%EA%B3%A0%EB%A6%AC%EC%84%A0%ED%83%9D%EA%B2%B0%EA%B3%BC
1296,150973788,1,남녀공용 발포 후드 맨투맨,여성의류,맨투맨_후드티,"12,000원",오버핏 95~105사이즈입니다상태 깨끗해요,부산광역시 동구 수정제1동,중고,2,https://m.bunjang.co.kr/products/150973788?ref=%EC%B9%B4%ED%85%8C%EA%B3%A0%EB%A6%AC%EC%84%A0%ED%83%9D%EA%B2%B0%EA%B3%BC
1297,150980552,1,커버낫 맨투맨,여성의류,맨투맨_후드티,"30,000원",사이즈 s입니다. 몇번 안입었고요 오염없습니다.,경기도 구리시 수택3동,중고,3,https://m.bunjang.co.kr/products/150980552?ref=%EC%B9%B4%ED%85%8C%EA%B3%A0%EB%A6%AC%EC%84%A0%ED%83%9D%EA%B2%B0%EA%B3%BC
1298,150986593,1,라이프워크 얇은롱티 원피스,여성의류,맨투맨_후드티,"35,000원",라이프워크 롱티입니다프리사이즈 입니다남녀공용택포35000,경기도 과천시 부림동,중고,2,https://m.bunjang.co.kr/products/150986593?ref=%EC%B9%B4%ED%85%8C%EA%B3%A0%EB%A6%AC%EC%84%A0%ED%83%9D%EA%B2%B0%EA%B3%BC
1299,150992155,1,칼하트 써멀 후드집업,여성의류,맨투맨_후드티,"37,000원","#칼하트 써멀 오버핏 후드집업총장68가슴단면60Price 3,7 #어베인옷장-모델 160cm / size44-📌두개이상 구매시 무료배송📌택배비3천원 제주산간6천원",서울특별시 양천구 신월5동,중고,2,https://m.bunjang.co.kr/products/150992155?ref=%EC%B9%B4%ED%85%8C%EA%B3%A0%EB%A6%AC%EC%84%A0%ED%83%9D%EA%B2%B0%EA%B3%BC
1300,150996073,1,럭키슈에뜨 아틀리에 프릴티셔츠,여성의류,맨투맨_후드티,"109,000원",럭키슈에뜨 아틀리에 프릴 롱 맨투맨36호새거상태현재매장판매중예민분 사양하고 찔러보기 하시는 분들 바로 차단합니다찜하지 마시고 바로  거래하실 분만 톡주세요스트레스 없는 쿨거래만 합니다중고특성상 반품 불가합니다 편의점택배 착불 보내드립니다,전국,중고,5,https://m.bunjang.co.kr/products/150996073?ref=%EC%B9%B4%ED%85%8C%EA%B3%A0%EB%A6%AC%EC%84%A0%ED%83%9D%EA%B2%B0%EA%B3%BC
1301,150997987,1,"아베크롬비 후드티(오버핏, 남성가능)",여성의류,맨투맨_후드티,"10,000원","아베크롬비 후드티입니다오버핏이라서 160cm 기준 엉덩이 덮어요남성도 입을 수 있어요~ 일반 택배는 3,000원 추가되며편의점 반값택배 가능해요  :)",경기도 안산시 단원구 호수동,중고,1,https://m.bunjang.co.kr/products/150997987?ref=%EC%B9%B4%ED%85%8C%EA%B3%A0%EB%A6%AC%EC%84%A0%ED%83%9D%EA%B2%B0%EA%B3%BC
1302,151006009,1,후아유 후드집업,여성의류,맨투맨_후드티,"7,000원",사용감 있습니다원가에 비해 싸게파는거에요！제가 제일 아끼는 후드집업이였는데 돈을 모아야해서 팔아요ㅠㅠㅠ교복에 입거나 그냥 아무렇게나 입어도 정말 이뻐요!연락 많이 주세요🙇‍♂️🙇‍♂️🙇‍♂️네고(가격내림)는 당연히 가능합니당,경기도 의정부시 자금동,중고,1,https://m.bunjang.co.kr/products/151006009?ref=%EC%B9%B4%ED%85%8C%EA%B3%A0%EB%A6%AC%EC%84%A0%ED%83%9D%EA%B2%B0%EA%B3%BC
1303,151011735,1,아디다스 맨투맨,여성의류,맨투맨_후드티,"13,000원",사이즈 90인데 체감 95정도되요,인천광역시 연수구 송도1동,중고,2,https://m.bunjang.co.kr/products/151011735?ref=%EC%B9%B4%ED%85%8C%EA%B3%A0%EB%A6%AC%EC%84%A0%ED%83%9D%EA%B2%B0%EA%B3%BC
1304,151013537,1,87mm 엠엠엘지 맨투맨,여성의류,맨투맨_후드티,"28,000원",사이즈 M하자없습니당,전국,중고,3,https://m.bunjang.co.kr/products/151013537?ref=%EC%B9%B4%ED%85%8C%EA%B3%A0%EB%A6%AC%EC%84%A0%ED%83%9D%EA%B2%B0%EA%B3%BC
1305,151017021,1,87mm 엠엠엘지 후드티,여성의류,맨투맨_후드티,"40,000원",사이즈 M하자없어용,전국,중고,1,https://m.bunjang.co.kr/products/151017021?ref=%EC%B9%B4%ED%85%8C%EA%B3%A0%EB%A6%AC%EC%84%A0%ED%83%9D%EA%B2%B0%EA%B3%BC
1306,151025826,1,나이키 크롭 맨투맨,여성의류,맨투맨_후드티,"60,000원",xs 실착 1회,전국,중고,2,https://m.bunjang.co.kr/products/151025826?ref=%EC%B9%B4%ED%85%8C%EA%B3%A0%EB%A6%AC%EC%84%A0%ED%83%9D%EA%B2%B0%EA%B3%BC
1307,151027645,1,카모 후드티,여성의류,맨투맨_후드티,"15,000원",,전라남도 목포시 용해동,중고,1,https://m.bunjang.co.kr/products/151027645?ref=%EC%B9%B4%ED%85%8C%EA%B3%A0%EB%A6%AC%EC%84%A0%ED%83%9D%EA%B2%B0%EA%B3%BC
1308,151031557,1,시눈 곰돌이 맨투맨,여성의류,맨투맨_후드티,"60,000원",시눈에서 구매한 맨투맨입니다🐻🤎봄신상으로 나오자마자 구매했는데막상 손이 잘 안가서 ㅠㅠ ...저보다 잘 입어주실 분께 보내드려고 합니다!!🥺교환/환불 불가쿨거시 무료배송해드립니다🧚‍♂️언제든 번톡 주세요❤️,전국,새상품,2,https://m.bunjang.co.kr/products/151031557?ref=%EC%B9%B4%ED%85%8C%EA%B3%A0%EB%A6%AC%EC%84%A0%ED%83%9D%EA%B2%B0%EA%B3%BC
1309,151048649,1,새상품)게스 봄가을맨투맨,여성의류,맨투맨_후드티,"12,000원","호주에서 6만원가량 주고 구매했구요 택만 제거한 새상품입니다xs사이즈라고 기재되어 있지만 여유있게 나와서66까지 가능할 것 같습니다 기장은 크롭은 아니지만 짧은편입니다어깨 47cm, 총장 53cm직거래는 용두역,제기역에서 가능합니다 택배시 +3,000원 입니다",서울특별시 동대문구 용신동,중고,3,https://m.bunjang.co.kr/products/151048649?ref=%EC%B9%B4%ED%85%8C%EA%B3%A0%EB%A6%AC%EC%84%A0%ED%83%9D%EA%B2%B0%EA%B3%BC
1310,151053307,1,후드집업,여성의류,맨투맨_후드티,"20,000원",택배비 착불입니다,전국,중고,1,https://m.bunjang.co.kr/products/151053307?ref=%EC%B9%B4%ED%85%8C%EA%B3%A0%EB%A6%AC%EC%84%A0%ED%83%9D%EA%B2%B0%EA%B3%BC
1311,151056241,1,에이블리 회색 후드집업(1번착용),여성의류,맨투맨_후드티,"9,000원",거파금 0.2,전국,중고,1,https://m.bunjang.co.kr/products/151056241?ref=%EC%B9%B4%ED%85%8C%EA%B3%A0%EB%A6%AC%EC%84%A0%ED%83%9D%EA%B2%B0%EA%B3%BC
1312,151056339,1,[여자 38 (90)]스텔라매카트니 정품 플리스 맨투맨,여성의류,맨투맨_후드티,"70,000원","[여자 38 (90)]STELLA McCARTNEY 스텔라매카트니 정품 플리스 맨투맨판매가격:70,000 (무료배송) 에눌조건:**2개 이상 구매시 개당 -3,000원 할인색상 및 섬유소재:블루/폴리에스터, 레이온 (안감 기모 아님)사이즈:여자 38사이즈 (90)실측사이즈(CM):어깨-53/가슴-54/총장-62Quality (새상품 대비):A-(새상품 N, 최상 A+, 상 A-, 중상 B+, 중 B-, 하 C)Condition:9.5/10하자유무:무상태설명:오염이나 하자없는 상품입니다.◈필독◈ 구매문의 전 제발 꼭!! 읽어주세요! (공지 미숙지로 인한 불이익 없길 바랍니다.)1. 주문 개수와 관계 없이 무료배송입니다.2. 24시간 구매문의 가능합니다.3. 선 입금, 선 결제 순 판매완료 입니다.4. 에눌은 복수구매(2개이상) 시에 해당됩니다.5. 2개 이상 구매시 개당 3,000원 할인6. 교환, 환불은 어려우니 신중한 구매 부탁드립니다.7. 배송접수는 주문 당일 오후 6시 이내 접수합니다. 8. 이후 시간 주문 건은 익일 접수 합니다. 9. 배송접수시간은 사정에 따라 달라질 수 있습니다.",경기도 남양주시 금곡동,중고,9,https://m.bunjang.co.kr/products/151056339?ref=%EC%B9%B4%ED%85%8C%EA%B3%A0%EB%A6%AC%EC%84%A0%ED%83%9D%EA%B2%B0%EA%B3%BC
