,img_id,number,title,category_big,category_mid,price,detail,region,status,file_count,url
457,139140666,1,기모 포인트 맨투맨,여성의류,맨투맨_후드티,"12,000원",***가격내림***겨울에 따뜻하게 입을 수있는 기모 맨투맨입니다^^  첫번째 맨투맨 앞 뒤 길이가 다른 기모 맨투맨입니다~ 끈으로 조절할 수있어서 크롭 느낌도 낼 수 있어요~두번째 맨투맨 프릴이 달려서 귀여운 느낌의 맨투맨입니다~ 안 쪽은 기모로 되어있어서 따뜻하게 입을 수있어요~각각 포인트가 있어서  일반 맨투맨과 다른 꾸안꾸룩입니다~^^~ 두가지 다 구매하고 한번정도 착용했고 거의 새상품입니다~  착용샷 필요하시면 톡주세요~ 함께 구매하시면 에눌해드려요~,경기도 고양시 덕양구 흥도동,중고,11,https://m.bunjang.co.kr/products/139140666?ref=%EC%B9%B4%ED%85%8C%EA%B3%A0%EB%A6%AC%EC%84%A0%ED%83%9D%EA%B2%B0%EA%B3%BC
458,139156857,1,베이프 집업후드s,여성의류,맨투맨_후드티,"110,000원",베이프 집업후드s 가오리핏이며 두껍지 않아 가볍게 걸치기 좋으며구입은 오래전에 했는데 착용횟수 적어요.오른쪽 소매(사진!!) 미세 오염 한군데 있고그외 상태 완전 좋습니다.간절기에 걸치기 좋은 두께감이에요사이즈는 하단단면47 총장61 이고가슴단면은 가오리핏이여서 넉넉해요.입으면 가오리느낌은 많이 안나요11만원쿨거래시 무료택배 보내드려요.직거래도 됩니다.​,경기도 수원시 권선구 권선2동,중고,9,https://m.bunjang.co.kr/products/139156857?ref=%EC%B9%B4%ED%85%8C%EA%B3%A0%EB%A6%AC%EC%84%A0%ED%83%9D%EA%B2%B0%EA%B3%BC
459,139165835,1,에센시스튜디오후드티   (개당가격),여성의류,맨투맨_후드티,"18,000원",새상품수준방송중  유재석 황정음이입었던옷도톰한원단 이구요소매부분 후드부분 자수처리 귀염귀염 하네요100정도 사이즈 여유핏입니다,경기도 용인시 기흥구 상갈동,중고,7,https://m.bunjang.co.kr/products/139165835?ref=%EC%B9%B4%ED%85%8C%EA%B3%A0%EB%A6%AC%EC%84%A0%ED%83%9D%EA%B2%B0%EA%B3%BC
460,139213747,1,[봄맞이]본지샵 박시 코알라 맨투맨,여성의류,맨투맨_후드티,"14,000원",지금은 품절인 상품입니다ㅜ입으면 포근해용맨투맨이 너무 많아서 정리합니당,전국,중고,3,https://m.bunjang.co.kr/products/139213747?ref=%EC%B9%B4%ED%85%8C%EA%B3%A0%EB%A6%AC%EC%84%A0%ED%83%9D%EA%B2%B0%EA%B3%BC
461,139227447,1,[무배] 칸코 맨투맨,여성의류,맨투맨_후드티,"13,000원",정가 59000원무신사에서 구매한 정품입니다안감 기모로 되어있어용상세 사이즈는 사진에 있습니다한번 잠깐 입어서 상태는 매우 좋구요무료배송 해드려요! 에눌 X색상은 실사보다 무신사 사진이 정확합니당 ❤️,전국,중고,5,https://m.bunjang.co.kr/products/139227447?ref=%EC%B9%B4%ED%85%8C%EA%B3%A0%EB%A6%AC%EC%84%A0%ED%83%9D%EA%B2%B0%EA%B3%BC
462,139238506,1,크럼프 플리스 후드집업,여성의류,맨투맨_후드티,"13,000원",L사이즈고 한번 입고는 잘 안맞는 것 같아서 그냥 팝니다교환 환불 xxxxx,경기도 안양시 만안구 안양2동,중고,1,https://m.bunjang.co.kr/products/139238506?ref=%EC%B9%B4%ED%85%8C%EA%B3%A0%EB%A6%AC%EC%84%A0%ED%83%9D%EA%B2%B0%EA%B3%BC
463,139279861,1,크롭 스트링 퍼 후드 집업,여성의류,맨투맨_후드티,"22,000원",저한테 좀 큰거같아 바로 팝니당 ㅜㅜ색상 아이보리비침 없고 신축성 있어용너무 숏하지 않은 기장감으로밑단 스트링이 있어 원하시는 핏으로 조절해 입으실 수 있고어떤 하의에 매치해도꾸안꾸룩으로 착용 가능합니당 ! ㅎㅎ(직거래가능) (택+2000)(반값택배가능),경기도 부천시 상동,새상품,3,https://m.bunjang.co.kr/products/139279861?ref=%EC%B9%B4%ED%85%8C%EA%B3%A0%EB%A6%AC%EC%84%A0%ED%83%9D%EA%B2%B0%EA%B3%BC
464,139302058,1,핑크 기모 맨투맨,여성의류,맨투맨_후드티,"4,000원",기모라서 따뜻하구 사진보다 살짝 밝은 연핑크입니다!,울산광역시 중구 태화동,중고,3,https://m.bunjang.co.kr/products/139302058?ref=%EC%B9%B4%ED%85%8C%EA%B3%A0%EB%A6%AC%EC%84%A0%ED%83%9D%EA%B2%B0%EA%B3%BC
465,139339390,1,챈스챈스 딸기우유 맨투맨,여성의류,맨투맨_후드티,"20,000원",상세 설명 없음,전국,중고,2,https://m.bunjang.co.kr/products/139339390?ref=%EC%B9%B4%ED%85%8C%EA%B3%A0%EB%A6%AC%EC%84%A0%ED%83%9D%EA%B2%B0%EA%B3%BC
466,139341603,1,나이키 핑크 크롭 맨투맨,여성의류,맨투맨_후드티,"35,000원",한두번 입았어용 엄청 크롭은 아니에요조커팬츠랑입어두존예💝,전국,중고,3,https://m.bunjang.co.kr/products/139341603?ref=%EC%B9%B4%ED%85%8C%EA%B3%A0%EB%A6%AC%EC%84%A0%ED%83%9D%EA%B2%B0%EA%B3%BC
467,139353571,1,뉴해빗 기모 맨투맨 (두번입고세탁),여성의류,맨투맨_후드티,"6,000원","예전에 사고 한번인가 두번입고 세탁해놓은 상태에요! 옷은 진짜 이쁜데 제가 파란색을 소화하기에는 무리가 있는거 같네요..ㅎㅎ사이즈 m인데 루즈핏이 아니라 정핏 이라서 평소 s 정도 입으시는분 맞으실거 같아요! 안에 기모도 있어서 부드러워요gs25 택배, 반값 택배 가능",경기도 용인시 수지구 죽전1동,중고,3,https://m.bunjang.co.kr/products/139353571?ref=%EC%B9%B4%ED%85%8C%EA%B3%A0%EB%A6%AC%EC%84%A0%ED%83%9D%EA%B2%B0%EA%B3%BC
468,139376865,1,벌룬 후드티 주황,여성의류,맨투맨_후드티,"10,000원","똑같은거 2개 사버렸어요 관심있는분 문의주세용 편택반값택배 , 일반택배",대구광역시 북구 구암동,중고,1,https://m.bunjang.co.kr/products/139376865?ref=%EC%B9%B4%ED%85%8C%EA%B3%A0%EB%A6%AC%EC%84%A0%ED%83%9D%EA%B2%B0%EA%B3%BC
469,139388950,1,푸마 양털 롱 후드집업,여성의류,맨투맨_후드티,"23,000원",너무 예쁜 롱후드티입니다안감이 털이라  엄청따뜻해요사용감 없고하자 없고상태  최고입니다싸이즈 55추천드려요직거래 일산서구택배비별도 & 착불,경기도 고양시 일산서구 송포동,중고,5,https://m.bunjang.co.kr/products/139388950?ref=%EC%B9%B4%ED%85%8C%EA%B3%A0%EB%A6%AC%EC%84%A0%ED%83%9D%EA%B2%B0%EA%B3%BC
470,139431360,1,CRITIC 후드 (L),여성의류,맨투맨_후드티,"11,000원",시보리에 생활 오염 좀 있어요원가 5만원대 샀어요,경기도 평택시 비전2동,중고,3,https://m.bunjang.co.kr/products/139431360?ref=%EC%B9%B4%ED%85%8C%EA%B3%A0%EB%A6%AC%EC%84%A0%ED%83%9D%EA%B2%B0%EA%B3%BC
471,139435107,1,(미착용 새상품)비바스튜디오 맨투맨,여성의류,맨투맨_후드티,"35,000원","S사이즈에요 ""미착용 새상품""입니다.현재 품절되서 재고 없는 상품이에요.정가""58000원""",인천광역시 남구 관교동,새상품,2,https://m.bunjang.co.kr/products/139435107?ref=%EC%B9%B4%ED%85%8C%EA%B3%A0%EB%A6%AC%EC%84%A0%ED%83%9D%EA%B2%B0%EA%B3%BC
472,139482720,1,크롭후드집업,여성의류,맨투맨_후드티,"12,000원",한번도 안입었습니당!!,전국,중고,6,https://m.bunjang.co.kr/products/139482720?ref=%EC%B9%B4%ED%85%8C%EA%B3%A0%EB%A6%AC%EC%84%A0%ED%83%9D%EA%B2%B0%EA%B3%BC
473,139495895,1,스파오 이상해씨 맨투맨,여성의류,맨투맨_후드티,"25,000원",2016년에 스파오에서 한정판으로 판매했던 포켓몬 맨투맨입니다.사이즈 미스로 2~3번 입고 보관중에 옷정리 하다가 정리합니다.한정판이라 매장에서는 더 이상 구할 수 없습니다.사이즈는 라지(100)이고 사용감 전혀 없습니다.남녀 공용 착용 가능합니다,인천광역시 계양구 효성2동,중고,4,https://m.bunjang.co.kr/products/139495895?ref=%EC%B9%B4%ED%85%8C%EA%B3%A0%EB%A6%AC%EC%84%A0%ED%83%9D%EA%B2%B0%EA%B3%BC
474,139502425,1,벌룬소매 배색 양털 맨투맨,여성의류,맨투맨_후드티,"7,000원",44-66 사이즈 프리사이즈오염 하자 없음두꺼운편이 아니라서 한겨울엔 안에 이너티 입고 착용 권장드리고 봄가을엔 그냥 한장만 입고 겉옷 입으시면 괜찮으실꺼에요!반값택배 1600 일반택배 3000,경기도 남양주시 화도읍,중고,2,https://m.bunjang.co.kr/products/139502425?ref=%EC%B9%B4%ED%85%8C%EA%B3%A0%EB%A6%AC%EC%84%A0%ED%83%9D%EA%B2%B0%EA%B3%BC
475,139531908,1,어나더랭귀지 스트링 스웻셔츠,여성의류,맨투맨_후드티,"10,000원",어나더랭귀지에서 구매하였습니다착용감잇는상품이고 세탁한적있습니다(희미하게 가슴쪽에 오염있습니다! 확인해보세요),서울특별시 광진구 군자동,중고,2,https://m.bunjang.co.kr/products/139531908?ref=%EC%B9%B4%ED%85%8C%EA%B3%A0%EB%A6%AC%EC%84%A0%ED%83%9D%EA%B2%B0%EA%B3%BC
476,139553349,1,검정 크롭 후드,여성의류,맨투맨_후드티,"15,000원",상태 좋아요~,경기도 성남시 분당구 야탑3동,중고,2,https://m.bunjang.co.kr/products/139553349?ref=%EC%B9%B4%ED%85%8C%EA%B3%A0%EB%A6%AC%EC%84%A0%ED%83%9D%EA%B2%B0%EA%B3%BC
477,139594474,1,[79]아디다스키즈 블랙 후드집업,여성의류,맨투맨_후드티,"20,000원",깔끔한 블랙색상에 모자부분 포인트안감 형광색인 아디다스키즈 후드집업 입니다! 하자라고 하면 뒷면에 스티치부분이 조금 헤진정도 말고는상태 좋습니다!많은문의주세여!,경상남도 진주시 충무공동,중고,3,https://m.bunjang.co.kr/products/139594474?ref=%EC%B9%B4%ED%85%8C%EA%B3%A0%EB%A6%AC%EC%84%A0%ED%83%9D%EA%B2%B0%EA%B3%BC
478,139596919,1,커버낫 후드티(네이비),여성의류,맨투맨_후드티,"43,000원",하자없고 상태좋아요정품맞고 S사이즈입니다,전국,중고,3,https://m.bunjang.co.kr/products/139596919?ref=%EC%B9%B4%ED%85%8C%EA%B3%A0%EB%A6%AC%EC%84%A0%ED%83%9D%EA%B2%B0%EA%B3%BC
479,139633240,1,스컬프터 한정판매 맨투맨,여성의류,맨투맨_후드티,"35,000원",하자 없어요 거의 새 상품 입니다같은 맨투맨 검정 흰색 교신 받습니다 쿨거시 네고해드립니다,전국,중고,2,https://m.bunjang.co.kr/products/139633240?ref=%EC%B9%B4%ED%85%8C%EA%B3%A0%EB%A6%AC%EC%84%A0%ED%83%9D%EA%B2%B0%EA%B3%BC
480,139671656,1,자라 오버사이즈 맨투맨,여성의류,맨투맨_후드티,"15,000원",자라 오버사이즈 맨투맨사이즈 s이나 매우 오버사이즈에요소매 벌룬디테일 있고사용감 없습니다,전국,중고,3,https://m.bunjang.co.kr/products/139671656?ref=%EC%B9%B4%ED%85%8C%EA%B3%A0%EB%A6%AC%EC%84%A0%ED%83%9D%EA%B2%B0%EA%B3%BC
481,139676658,1,헤브어굿타임 후드,여성의류,맨투맨_후드티,"31,000원","--------------------------------------------------상품명 - 헤브어굿타임 후드가격 - 31,000사이즈 - M실측 - 가슴 56 기장 69상태 - 10/8.5--------------------------------------------------☁️ 모든 상품은 세탁, 건조, 향균 스팀 작업 후 판매합니다.☁️ 문의는 DM으로 주세요. 선입금순으로 판매됩니다.☁️ 하자는 미리 사진에 고지하여 드리고 있으나 발견치 못한 미세 오염이나 사용감, 데미지 등이 있을 수 있습니다. 민감하신 분들은 신중한 구매 바랍니다.☁️ 사이즈는 상품에 기재되어 있는 사이즈입니다. 정확한 측정은 실측으로 부탁드립니다.☁️ 상품 사진은 아이폰 기본 촬영이며 휴대폰의 기종, 밝기 등에 따라 상품의 색상이 상이해질 수 있으니 참고 부탁드립니다.--------------------------------------------------",전국,중고,1,https://m.bunjang.co.kr/products/139676658?ref=%EC%B9%B4%ED%85%8C%EA%B3%A0%EB%A6%AC%EC%84%A0%ED%83%9D%EA%B2%B0%EA%B3%BC
482,139682670,1,유니클로 집업,여성의류,맨투맨_후드티,"4,000원",유니클로 집업입니다😃사이즈는 m이구요4000원입니당😎,경기도 고양시 일산동구 식사동,중고,4,https://m.bunjang.co.kr/products/139682670?ref=%EC%B9%B4%ED%85%8C%EA%B3%A0%EB%A6%AC%EC%84%A0%ED%83%9D%EA%B2%B0%EA%B3%BC
483,139702002,1,엘레쎄 후드집업,여성의류,맨투맨_후드티,"15,000원",엘레쎄 후드집업 팝니다! 기모버전이고 블랙 100 입니다! 사용감이 좀 있습니다! 가격고정입니다!,전국,중고,3,https://m.bunjang.co.kr/products/139702002?ref=%EC%B9%B4%ED%85%8C%EA%B3%A0%EB%A6%AC%EC%84%A0%ED%83%9D%EA%B2%B0%EA%B3%BC
484,139713946,1,(새상품) 자라 맨투맨,여성의류,맨투맨_후드티,"9,000원",자라에서 구매한 가오리핏 맨투맨 M사이즈입니다.새상품 다홍색상이구요색상이 예뻐서 구매했는데평소 잘 입는 스타일이아니라 팔아요!,서울특별시 마포구 합정동,새상품,2,https://m.bunjang.co.kr/products/139713946?ref=%EC%B9%B4%ED%85%8C%EA%B3%A0%EB%A6%AC%EC%84%A0%ED%83%9D%EA%B2%B0%EA%B3%BC
485,139732630,1,mmlg 보라색 후드티 S (라벤더),여성의류,맨투맨_후드티,"20,000원",사이즈 s 여성분색상은 마지막샷과 비슷합니다 쫌 입었던거라 싸게 팝니다 편하게 연락주세요!,부산광역시 부산진구 개금제3동,중고,3,https://m.bunjang.co.kr/products/139732630?ref=%EC%B9%B4%ED%85%8C%EA%B3%A0%EB%A6%AC%EC%84%A0%ED%83%9D%EA%B2%B0%EA%B3%BC
486,139733774,1,여자 뉴발란스 후드티,여성의류,맨투맨_후드티,"37,000원",여자 뉴발란스 후드티색상: 그레이사이즈:85교신 안해요,전국,중고,3,https://m.bunjang.co.kr/products/139733774?ref=%EC%B9%B4%ED%85%8C%EA%B3%A0%EB%A6%AC%EC%84%A0%ED%83%9D%EA%B2%B0%EA%B3%BC
487,139763219,1,유니클로 후리스,여성의류,맨투맨_후드티,"30,000원",사이즈 xs 색상은 사진보다 조금 더 진한거 같아요 !!,전국,중고,1,https://m.bunjang.co.kr/products/139763219?ref=%EC%B9%B4%ED%85%8C%EA%B3%A0%EB%A6%AC%EC%84%A0%ED%83%9D%EA%B2%B0%EA%B3%BC
488,139780768,1,맨투맨 니트 가디건 남방 스웨트셔츠 파랑가을체크베이지와인벼룩판매떨이,여성의류,맨투맨_후드티,"5,900원","🌷맨투맨, 가디건, 니트, 남방(셔츠) 판매🌷❤맨투맨 빼고 시착 3회 미만❤이사하는데 잘 안 입었던 옷들은 파는 게 좋을 것 같아 팝니다✨3벌 구매 시 1000원 할인✨❤대게 상태 좋은 것들인데 보관만 했음에도 불구하고 완전한 새상품을 원하는 매우 예민하신 분들은 피해주세요 - gs반값택배 가능 1900~2200 - 택배 3500(한 벌일 경우) - 교환,환불,직거래 ❌",전국,중고,7,https://m.bunjang.co.kr/products/139780768?ref=%EC%B9%B4%ED%85%8C%EA%B3%A0%EB%A6%AC%EC%84%A0%ED%83%9D%EA%B2%B0%EA%B3%BC
489,139852529,1,클로버캐년 맨투맨,여성의류,맨투맨_후드티,"70,000원",xs(어깨단면58 팔기장53 가슴단면52 총장69)네오프렌에 가까운 소재 특성상 주름이 거의 없습니다. 안감이 기모처리가 되어 있어 보온성이 뛰어납니다. 고급스러운 프린팅 자체로 포인트 주기가 좋습니다. 추가 문의사항 연락주세요.,서울특별시 송파구 잠실본동,중고,5,https://m.bunjang.co.kr/products/139852529?ref=%EC%B9%B4%ED%85%8C%EA%B3%A0%EB%A6%AC%EC%84%A0%ED%83%9D%EA%B2%B0%EA%B3%BC
490,139857870,1,오아이오아이 맨투맨,여성의류,맨투맨_후드티,"25,000원",오아이오아이 핑크색 맨투맨이고 색깔은 사진보다 좀더 밝아요 기모없는제품입니다 2번입었는데 저랑 톤이 안어울린다고 해서 팔아요... 사이즈는 프리 사이즈입니다!! 번톡 편하게 주세요(택배거래시 +3000),광주광역시 동구 계림1동,중고,5,https://m.bunjang.co.kr/products/139857870?ref=%EC%B9%B4%ED%85%8C%EA%B3%A0%EB%A6%AC%EC%84%A0%ED%83%9D%EA%B2%B0%EA%B3%BC
491,139967558,1,(L) oioi 후드티,여성의류,맨투맨_후드티,"19,000원",사이즈는 L입니다실사는 사진이랑 흡사합니다사용감이 살짝 있어 싸게 내놓습니다 !!택포 + 2500,대구광역시 북구 관음동,중고,3,https://m.bunjang.co.kr/products/139967558?ref=%EC%B9%B4%ED%85%8C%EA%B3%A0%EB%A6%AC%EC%84%A0%ED%83%9D%EA%B2%B0%EA%B3%BC
492,140007709,1,m) 오아이오아이 맨투맨,여성의류,맨투맨_후드티,"37,900원",m사이즈입니다사이즈표 뒷페이지 참고 부탁드려요🙏🏻,전국,중고,3,https://m.bunjang.co.kr/products/140007709?ref=%EC%B9%B4%ED%85%8C%EA%B3%A0%EB%A6%AC%EC%84%A0%ED%83%9D%EA%B2%B0%EA%B3%BC
493,140095515,1,"둘다 구매시 무배)후아유 후드티,보세 후드티",여성의류,맨투맨_후드티,"10,000원",핑크는 후아유에서 구매했고요 회색은 보세 브랜드입니다개당 만원이고요 둘다 구매하시면서 cu편의점씨리 택배시 무배입니다cu 편의점끼리 택배 가능우체국 택배 가능당진시 사시면 직거래 가능,충청남도 당진시 당진1동,중고,4,https://m.bunjang.co.kr/products/140095515?ref=%EC%B9%B4%ED%85%8C%EA%B3%A0%EB%A6%AC%EC%84%A0%ED%83%9D%EA%B2%B0%EA%B3%BC
494,140119492,1,[정품-미착용새상품] 이자벨마랑에뚜왈 모비 ss21 신상 에크루컬러 36,여성의류,맨투맨_후드티,"270,000원",ISABEL MARANT ETOILE Moby sweatshirt이자벨마랑 모비 스웻셔츠- 에크루 + 레드그라데이션 ( 21년 신상컬러 )• 36 사이즈 ( 가슴단면: 56cm / 총기장: 57cm )- 텍 부착된 새상품- 직거래 가능 ( 7호선 내방역 인근 ) - 택배 가능 ( 편의점 - 대한통운 택배 이용 )# 매너거래 원해요 ( 에눌 및 교신문의 정중히 사양해요 )# 구매의사 확실하신 분만 연락주세요# 문의시 어떤제품인지 꼭 밝혀주세요,서울특별시 서초구 방배본동,새상품,8,https://m.bunjang.co.kr/products/140119492?ref=%EC%B9%B4%ED%85%8C%EA%B3%A0%EB%A6%AC%EC%84%A0%ED%83%9D%EA%B2%B0%EA%B3%BC
495,140119656,1,락스터드 찡 트레이닝 세트,여성의류,맨투맨_후드티,"33,000원",3번정도 입은 트레이닝세트구여 네오프랜재질입니다문의주세용 세트가격이에요,전국,중고,3,https://m.bunjang.co.kr/products/140119656?ref=%EC%B9%B4%ED%85%8C%EA%B3%A0%EB%A6%AC%EC%84%A0%ED%83%9D%EA%B2%B0%EA%B3%BC
496,140144136,1,가격다운!_스티치 맨투맨,여성의류,맨투맨_후드티,"12,000원",어깨라인 예쁘게 내려오는 스티치 맨투맨입니다.실착 1번,광주광역시 광산구 어룡동,중고,3,https://m.bunjang.co.kr/products/140144136?ref=%EC%B9%B4%ED%85%8C%EA%B3%A0%EB%A6%AC%EC%84%A0%ED%83%9D%EA%B2%B0%EA%B3%BC
497,140150382,1,나이키 맨투맨,여성의류,맨투맨_후드티,"30,000원",상태 괜찮아요!사용감은 약간 있을수있어요m사이즈,전국,중고,3,https://m.bunjang.co.kr/products/140150382?ref=%EC%B9%B4%ED%85%8C%EA%B3%A0%EB%A6%AC%EC%84%A0%ED%83%9D%EA%B2%B0%EA%B3%BC
498,140181560,1,아디다스 트레포일 오버 크루 남여공용,여성의류,맨투맨_후드티,"25,000원",아디다스M남여공용오렌지반값택배 cu가능해요교신사양합니다 ,경상북도 구미시 인동동,중고,5,https://m.bunjang.co.kr/products/140181560?ref=%EC%B9%B4%ED%85%8C%EA%B3%A0%EB%A6%AC%EC%84%A0%ED%83%9D%EA%B2%B0%EA%B3%BC
499,140191261,1,무배.새상품 양기모 후드집업,여성의류,맨투맨_후드티,"29,500원",                 양기모 도톰한 후드집업⚫사이즈 free ⚫컬러 .수박.오트.⚫소재 코튼.기모​총장71.어깨61.소매길이66,부산광역시 강서구 녹산동,새상품,5,https://m.bunjang.co.kr/products/140191261?ref=%EC%B9%B4%ED%85%8C%EA%B3%A0%EB%A6%AC%EC%84%A0%ED%83%9D%EA%B2%B0%EA%B3%BC
500,140200680,1,로맨틱크라운 맨투맨 m,여성의류,맨투맨_후드티,"30,000원",네이비색상 m사이즈 3번 착용상세사이즈표 확인 부탁드립니다번톡주세요! 택포3,전국,중고,4,https://m.bunjang.co.kr/products/140200680?ref=%EC%B9%B4%ED%85%8C%EA%B3%A0%EB%A6%AC%EC%84%A0%ED%83%9D%EA%B2%B0%EA%B3%BC
501,140213325,1,여성 오버핏 맨투맨,여성의류,맨투맨_후드티,"12,000원","여성 오버핏 맨투맨입니다(상세 사이즈는 사진을 참고해주세요)✔️색상:네이비     실착:1회 /사용감 적고 깨끗합니다✔️두툼한 오버핏 맨투맨입니다그냥 입어도 예쁘고 안에 폴라티랑 같이 레이어드 해서 입어도 예뻐요✅배송비 2600원/gs25반값택배 가능     교환,환불,교신,에눌X     빠른 발송 해드려요( ◡̉̈ )",전국,중고,9,https://m.bunjang.co.kr/products/140213325?ref=%EC%B9%B4%ED%85%8C%EA%B3%A0%EB%A6%AC%EC%84%A0%ED%83%9D%EA%B2%B0%EA%B3%BC
502,140213704,1,탑텐 반목 지퍼 맨투맨 프리사이즈free,여성의류,맨투맨_후드티,"3,000원","탑텐 구매했구요진베이지 컬러의 맨투맨입니다목부분 답답하지 않게 넥부분 살짝 올라와있구요, 지퍼가 있어 포인트로 여닫고 입어도 이쁩니다.사이즈는 프리사이즈입니다.가슴단면 57cm로 넉넉하구요앞뒤 기장이 조금 다른데 앞은55, 뒤는60정도 되네요얇은 맨투맨입니다 참고부탁 드려요~^^서울 군자역 직거래,택배 모두 합니다.택배비는 별도입니다^^",서울특별시 광진구 중곡제2동,중고,4,https://m.bunjang.co.kr/products/140213704?ref=%EC%B9%B4%ED%85%8C%EA%B3%A0%EB%A6%AC%EC%84%A0%ED%83%9D%EA%B2%B0%EA%B3%BC
503,140225340,1,다이애그널 맨투맨,여성의류,맨투맨_후드티,"35,000원",사용감 거의 없이 깨끗히 입었습니다! 손이 잘 안가서 판매해요연락주세요!,경기도 수원시 팔달구 화서1동,중고,2,https://m.bunjang.co.kr/products/140225340?ref=%EC%B9%B4%ED%85%8C%EA%B3%A0%EB%A6%AC%EC%84%A0%ED%83%9D%EA%B2%B0%EA%B3%BC
504,140228602,1,주황 악어 프라사이즈 맨투맨,여성의류,맨투맨_후드티,"15,000원",,전국,중고,1,https://m.bunjang.co.kr/products/140228602?ref=%EC%B9%B4%ED%85%8C%EA%B3%A0%EB%A6%AC%EC%84%A0%ED%83%9D%EA%B2%B0%EA%B3%BC
505,140241834,1,스컬프터맨투맨,여성의류,맨투맨_후드티,"20,000원",스컬프터 맨투맨입니다! 공홈품절이고요 색감너무예쁩니다,전국,중고,2,https://m.bunjang.co.kr/products/140241834?ref=%EC%B9%B4%ED%85%8C%EA%B3%A0%EB%A6%AC%EC%84%A0%ED%83%9D%EA%B2%B0%EA%B3%BC
506,140266264,1,업타운홀릭 뽀글이맨투맨,여성의류,맨투맨_후드티,"15,000원",구매하고 한번 착용했습니당 ! 부드러워용 !,전국,중고,1,https://m.bunjang.co.kr/products/140266264?ref=%EC%B9%B4%ED%85%8C%EA%B3%A0%EB%A6%AC%EC%84%A0%ED%83%9D%EA%B2%B0%EA%B3%BC
507,140372944,1,챔피온 후드티 여성M,여성의류,맨투맨_후드티,"25,000원","챔피온 후드티네이비 여성 M상태 좋습니다 직거래 가능010-이천번, 삼삼오삼 ",인천광역시 서구 연희동,중고,5,https://m.bunjang.co.kr/products/140372944?ref=%EC%B9%B4%ED%85%8C%EA%B3%A0%EB%A6%AC%EC%84%A0%ED%83%9D%EA%B2%B0%EA%B3%BC
508,140437413,1,테디베어 맨투맨 (택포),여성의류,맨투맨_후드티,"10,000원",테디베어 맨투맨 팔아요!딱 한번밖에 안입어봤고 누구나 귀엽게 입으실 수 있을거 같아용 흑발이신 분들도 엄청잘어울릴거 같아요!!제가 입을려했지만 돈이 급해서 팝니다ㅠㅠ더 자세한건 번톡으로 편하게 문의주세요! ♡꙼̈,전국,중고,2,https://m.bunjang.co.kr/products/140437413?ref=%EC%B9%B4%ED%85%8C%EA%B3%A0%EB%A6%AC%EC%84%A0%ED%83%9D%EA%B2%B0%EA%B3%BC
509,140455067,1,아디다스 맨투맨,여성의류,맨투맨_후드티,"19,000원",상태좋아요~~루즈핏입니다.,전국,중고,5,https://m.bunjang.co.kr/products/140455067?ref=%EC%B9%B4%ED%85%8C%EA%B3%A0%EB%A6%AC%EC%84%A0%ED%83%9D%EA%B2%B0%EA%B3%BC
510,140456803,1,나이키 집업,여성의류,맨투맨_후드티,"17,000원",정품입니다.,전국,중고,4,https://m.bunjang.co.kr/products/140456803?ref=%EC%B9%B4%ED%85%8C%EA%B3%A0%EB%A6%AC%EC%84%A0%ED%83%9D%EA%B2%B0%EA%B3%BC
511,140464135,1,유엔지레이어 후드티,여성의류,맨투맨_후드티,"15,000원",유엔지레이어 후드티 판매합니다 사용감 있어서 싸게 판매해요 쿨거시 택포해드리겠습니다~!,전국,중고,2,https://m.bunjang.co.kr/products/140464135?ref=%EC%B9%B4%ED%85%8C%EA%B3%A0%EB%A6%AC%EC%84%A0%ED%83%9D%EA%B2%B0%EA%B3%BC
512,140466121,1,oioi후드티,여성의류,맨투맨_후드티,"13,000원",어깨단면 54가슴단면 56기장 70소매 안쪽과 후드 안쪽 앞부분에 사용감있고 그외에는 대체로 양호합니다구입당시 79000원에 구입했던 제품입니다직거래시 옥수동이고 배송비는 4000원입니다,서울특별시 성동구 옥수동,중고,5,https://m.bunjang.co.kr/products/140466121?ref=%EC%B9%B4%ED%85%8C%EA%B3%A0%EB%A6%AC%EC%84%A0%ED%83%9D%EA%B2%B0%EA%B3%BC
