,img_id,number,title,category_big,category_mid,price,detail,region,status,file_count,url
823,148561756,1,새상품) 반팔 롱원피스,여성의류,원피스,"11,000원",피치색상여름소재프리사이즈55-66반무배,서울특별시 송파구 거여2동,새상품,1,https://m.bunjang.co.kr/products/148561756?ref=%EC%B9%B4%ED%85%8C%EA%B3%A0%EB%A6%AC%EC%84%A0%ED%83%9D%EA%B2%B0%EA%B3%BC
824,148582837,1,리본 끈 플리츠 롱 원피스,여성의류,원피스,"22,000원",딱 한번 입고 보관중입니다 여리여리해 보이구 재질도 시원해요! ,전국,중고,9,https://m.bunjang.co.kr/products/148582837?ref=%EC%B9%B4%ED%85%8C%EA%B3%A0%EB%A6%AC%EC%84%A0%ED%83%9D%EA%B2%B0%EA%B3%BC
825,148615999,1,마랑 원피스 (66),여성의류,원피스,"20,000원",사이즈66 가슴47 총장90,서울특별시 구로구 수궁동,중고,4,https://m.bunjang.co.kr/products/148615999?ref=%EC%B9%B4%ED%85%8C%EA%B3%A0%EB%A6%AC%EC%84%A0%ED%83%9D%EA%B2%B0%EA%B3%BC
826,148631473,1,스파오 앨리스 에이프런 랩원피스,여성의류,원피스,"10,000원","롱원피스랑 함께 코디하면 정말 예쁜 에이프런이에요 :)진한 네이비 컬러에 묶을 수 있는 리본끈, 자수, 박음질 퀄리티까지 좋아요 💕원피스에 에이프런 코디 좋아하시는 분이라면 분명 만족하실것 같아요 :)1회 잠깐 착용해서 상태 좋아요💖반값택배 1600원, 일반택배 3000원 추가해주시면 됩니다 !사이즈s) 가슴단면 50 총장 92cm 넉넉한편이라 레이어드하기 좋아요 !",전국,중고,9,https://m.bunjang.co.kr/products/148631473?ref=%EC%B9%B4%ED%85%8C%EA%B3%A0%EB%A6%AC%EC%84%A0%ED%83%9D%EA%B2%B0%EA%B3%BC
827,148653974,1,딜라잇문 샤인트 원피스,여성의류,원피스,"35,000원",전체적인 상태는 좋으나 벨트부분은 어쩔 수 없는 구김 사용감 약간있어요! 지금은 품절상품입니다,경기도 고양시 덕양구 고양동,중고,5,https://m.bunjang.co.kr/products/148653974?ref=%EC%B9%B4%ED%85%8C%EA%B3%A0%EB%A6%AC%EC%84%A0%ED%83%9D%EA%B2%B0%EA%B3%BC
828,148683050,1,빈티지 pink house 핑크하우스 테디베어 오버롤 멜빵,여성의류,원피스,"50,000원",일본 브랜드 핑크 하우스 오버롤입니다기장 수선해서 164에 무릎 위까지 와요구입 후 착용샷 찍고 보관만 했습니다 세탁x총장 88 허리단면 42 택배비+3000 gs반값택배+1600,전국,중고,7,https://m.bunjang.co.kr/products/148683050?ref=%EC%B9%B4%ED%85%8C%EA%B3%A0%EB%A6%AC%EC%84%A0%ED%83%9D%EA%B2%B0%EA%B3%BC
829,148684117,1,(새제품)랄프로렌 원피스,여성의류,원피스,"89,000원",랄프로렌 원피스 새제품입니다8사이즈인데 66사이즈 입으시면  될겁니다제키가 162인데 무릎 살짝덮는 기장입니다소매가 가오리핏으로 독특합니다.저는 55사이즈인데 살짝 여유있게 입어도 되지만 66이 예쁘게 핏이 맞을겁니다로렌의 유명한 랩원피스처럼 저지 소재로 되어있어 입고벗기 편합니다무엇보다 색상이 화려합니다환불교환안되니 신중한 선택부탁드립니다,부산광역시 수영구 민락동,새상품,5,https://m.bunjang.co.kr/products/148684117?ref=%EC%B9%B4%ED%85%8C%EA%B3%A0%EB%A6%AC%EC%84%A0%ED%83%9D%EA%B2%B0%EA%B3%BC
830,148686854,1,(새제품)랄프로렌 쉬폰 원피스,여성의류,원피스,"89,000원",랄프로렌 쉬폰 원피스 새제품입니다.55사이즈. 끈으로 묶는 스탈.뒤에 지퍼가 있습니다.하늘하늘거려서 봄에 입기 딱입니다.미국서 할인가로 구매했습니다.택가격은 텍스 미포함인거 아시죠?싸게 내놓습니다.환불교환안되니  신중한 선택부탁드려요,부산광역시 수영구 민락동,새상품,5,https://m.bunjang.co.kr/products/148686854?ref=%EC%B9%B4%ED%85%8C%EA%B3%A0%EB%A6%AC%EC%84%A0%ED%83%9D%EA%B2%B0%EA%B3%BC
831,148688404,1,민소매 원피스,여성의류,원피스,"12,000원","날씬 55 까지 가능하며, 총길이 82cm 정도됩니다리본끈은 자유롭게 연출 가능합니다~^^",경기도 남양주시 평내동,중고,2,https://m.bunjang.co.kr/products/148688404?ref=%EC%B9%B4%ED%85%8C%EA%B3%A0%EB%A6%AC%EC%84%A0%ED%83%9D%EA%B2%B0%EA%B3%BC
832,148698515,1,셔링 원피스,여성의류,원피스,"14,000원",착용1하자 오염 x색상 : 블랙원가 2.5진짜 이쁜데 돈 급해서 팔까말까 고민 백번 했어요.. 빨리 채가세용 🥺,경상남도 창원시 의창구 북면,중고,2,https://m.bunjang.co.kr/products/148698515?ref=%EC%B9%B4%ED%85%8C%EA%B3%A0%EB%A6%AC%EC%84%A0%ED%83%9D%EA%B2%B0%EA%B3%BC
833,148702450,1,벨트 코튼 원피스 아이보리,여성의류,원피스,"29,000원",4만원대 구입1회 착용 후 세탁하고 보관중배송비 +3000,대구광역시 북구 동천동,새상품,3,https://m.bunjang.co.kr/products/148702450?ref=%EC%B9%B4%ED%85%8C%EA%B3%A0%EB%A6%AC%EC%84%A0%ED%83%9D%EA%B2%B0%EA%B3%BC
834,148751475,1,빅사이즈 임산부가능 나이키 롱원피스 귤색,여성의류,원피스,"27,000원",상세 설명 없음,대구광역시 달서구 죽전동,새상품,4,https://m.bunjang.co.kr/products/148751475?ref=%EC%B9%B4%ED%85%8C%EA%B3%A0%EB%A6%AC%EC%84%A0%ED%83%9D%EA%B2%B0%EA%B3%BC
835,148768977,1,(새상품) 플라워롱원피스,여성의류,원피스,"29,000원","💜 (새상품) 플라워롱원피스💜 남색은 누구에게나 잘어울리고 누구나 사랑하는 색깔이죠-! 또 어디에든 잘어울려 단독으로 입어도 니트 밑에 입어도 너무 예쁩니다.💜 허리를 잡아주는 묶을 수 있는 끈이 있어서 핏이 더 예뻐요. 허리가 길어보이는 타입이 아닌 허리를 잡아줘서 비율이 더 좋아보인답니다.💜 또, 원피스 뒤에는 지퍼가 있습니다.💜 어깨42/가슴46/암홀25/소매55/총장115💜 실가격 : 39000 -> 판매가격 : 30000💜 직거래시 부산진역 1번출구 앞, 택배시 배송비를 따로 받습니다.",부산광역시 동구 수정제2동,새상품,5,https://m.bunjang.co.kr/products/148768977?ref=%EC%B9%B4%ED%85%8C%EA%B3%A0%EB%A6%AC%EC%84%A0%ED%83%9D%EA%B2%B0%EA%B3%BC
836,148803078,1,케네스레이디 트위드 원피스,여성의류,원피스,"50,000원",세번 입어서 깨끗하고 단정하고 정말 예쁜데 이제 입을 일이 없어서 팔아요 과하지 않지만 화사해서 실물이 더 예뻐요ㅠㅠ사이즈는 마지막 사진 참고해주세요,전국,중고,5,https://m.bunjang.co.kr/products/148803078?ref=%EC%B9%B4%ED%85%8C%EA%B3%A0%EB%A6%AC%EC%84%A0%ED%83%9D%EA%B2%B0%EA%B3%BC
837,148803791,1,진주 배색카라 플레어 니트 원피스 반값!,여성의류,원피스,"25,000원",반값에 판매해요 한번 착용했고 다시 드라이 맡겨놨어요도톰하고 너무이뻐요..,서울특별시 영등포구 당산제2동,새상품,5,https://m.bunjang.co.kr/products/148803791?ref=%EC%B9%B4%ED%85%8C%EA%B3%A0%EB%A6%AC%EC%84%A0%ED%83%9D%EA%B2%B0%EA%B3%BC
838,148811514,1,뷔스티에,여성의류,원피스,"6,000원",깨끗하게몇 번 안 입었어용!!,경상북도 영주시 휴천1동,중고,1,https://m.bunjang.co.kr/products/148811514?ref=%EC%B9%B4%ED%85%8C%EA%B3%A0%EB%A6%AC%EC%84%A0%ED%83%9D%EA%B2%B0%EA%B3%BC
839,148817585,1,오브제 럭셔리롱원피스,여성의류,원피스,"200,000원",럭셔리한 롱원피스입니다 교환반품불가이며 에눌문의 정중히 사양합니다 착불입니다 ,부산광역시 동래구 복산동,중고,5,https://m.bunjang.co.kr/products/148817585?ref=%EC%B9%B4%ED%85%8C%EA%B3%A0%EB%A6%AC%EC%84%A0%ED%83%9D%EA%B2%B0%EA%B3%BC
840,148817609,1,플라스틱아일랜드 원피스,여성의류,원피스,"30,000원",플라스틱아일랜드에서 구매했고요두세번 입어서 깨끗해요!라인 잡혀서 날씬해보이고 예뻐요!아래 치마부분고 밋밋해보이지 않게 랩!처럼 되어있어서 더 예뻐요,전국,중고,3,https://m.bunjang.co.kr/products/148817609?ref=%EC%B9%B4%ED%85%8C%EA%B3%A0%EB%A6%AC%EC%84%A0%ED%83%9D%EA%B2%B0%EA%B3%BC
841,148835759,1,트렌치 점프슈트,여성의류,원피스,"50,000원",벨트포함  베이지점프슈트 한번도 입고나간적없는새상품 ㅜㅜ팝니다..이쁘고 특이해요  흔하지않음,경기도 수원시 권선구 권선1동,중고,3,https://m.bunjang.co.kr/products/148835759?ref=%EC%B9%B4%ED%85%8C%EA%B3%A0%EB%A6%AC%EC%84%A0%ED%83%9D%EA%B2%B0%EA%B3%BC
842,148835865,1,벨트 원피스,여성의류,원피스,"30,000원",구매하고 한번도안입고나간 새상품..무릎가리는 기장 새거에요 베이지색 ㅜㅜ 첫번째모델사진색임,경기도 수원시 권선구 권선1동,중고,3,https://m.bunjang.co.kr/products/148835865?ref=%EC%B9%B4%ED%85%8C%EA%B3%A0%EB%A6%AC%EC%84%A0%ED%83%9D%EA%B2%B0%EA%B3%BC
843,148863763,1,구룸 롱원피스,여성의류,원피스,"45,000원",,경기도 평택시 진위면,새상품,6,https://m.bunjang.co.kr/products/148863763?ref=%EC%B9%B4%ED%85%8C%EA%B3%A0%EB%A6%AC%EC%84%A0%ED%83%9D%EA%B2%B0%EA%B3%BC
844,148874213,1,일본수입 뜨게끈원피스 무료배송,여성의류,원피스,"17,000원","총장 끈제외 97. 끈조절가능      가슴단면 39  뒤허리 전체스모킹44-55반  권장드립니다 ~~가슴뜨게질부분도 안감있어서 비칠염려없어요~^^굉장히 여성스럽고 상큼해요~^^치마도 안감있어요~요즘 가디건안에 입기 좋을거같아요~^^상태최상 거의새옷입니다 ~~♡♡오염절대없어요~~!^^무료배송.당일발송 . 제물품 여러개하실경우 묶음배송해드리고2개째 물품부터는 2천원씩 할인해드립니다~♡♡2개 2천원할인,3개 4천원할인.....이런식으로요~^^주문주시면 문자안내드립니다~~항상 좋은물건 저렴히 드리기위해 노력하고 있습니다 ~언제든지 궁금하신점.불변하신점 연락주세요~항상 감사합니다 ~~♡♡♡♡♡재구매분들 한벌당 천원씩 추가할인히니드립니다~주문시 재구매라고 말씀해주세요 ~♡",서울특별시 송파구 송파1동,중고,10,https://m.bunjang.co.kr/products/148874213?ref=%EC%B9%B4%ED%85%8C%EA%B3%A0%EB%A6%AC%EC%84%A0%ED%83%9D%EA%B2%B0%EA%B3%BC
845,148875599,1,봄신상 프릴꽃쉬폰원피스,여성의류,원피스,100원,프리사이즈구용 블랙 아이보리 있어용 ~궁금하신점 문의주세용 ***-****-****,경기도 평택시 신평동,새상품,2,https://m.bunjang.co.kr/products/148875599?ref=%EC%B9%B4%ED%85%8C%EA%B3%A0%EB%A6%AC%EC%84%A0%ED%83%9D%EA%B2%B0%EA%B3%BC
846,148883691,1,레니본 여름 투피스,여성의류,원피스,"55,000원","< 레니본 투피스 > 65size상의 1회착용, 하의는 새상품으로 택 부착되어있습니다.아주 잘 보관해서 깨끗합니다~투피스로 입으셔도 예쁘고, 따로 코디하셔도 👍🏻이제는 구할수도 없는 상품 저렴히 득템해가세요!",전라남도 무안군 삼향읍,새상품,6,https://m.bunjang.co.kr/products/148883691?ref=%EC%B9%B4%ED%85%8C%EA%B3%A0%EB%A6%AC%EC%84%A0%ED%83%9D%EA%B2%B0%EA%B3%BC
847,148922926,1,시스루 슬릿 끈원피스,여성의류,원피스,"5,000원",안에 짧게 속치마도 덧대어져 있습니다그래도 안에 밝은속옷은 입으셔야해요 밝은속옷 입으면 단독착용가능 예뻐요😊이거에 워커신으면ㄴ완전 백예린2개이상 구매시 택배비 내가지불!(반값택배),전국,중고,5,https://m.bunjang.co.kr/products/148922926?ref=%EC%B9%B4%ED%85%8C%EA%B3%A0%EB%A6%AC%EC%84%A0%ED%83%9D%EA%B2%B0%EA%B3%BC
848,148977594,1,니트롱원피스,여성의류,원피스,"19,000원",총장 10866언냐들까지 옙브게 맞으실듯 하세요니트 원피스만 27000에 구매했어요피팅만 해보고 얼마전에  구매한 상품이에요티셔츠는 서비스로  같이 보내드릴게요다른 궁금한점 있으시면 편하게 문의주세요,경기도 고양시 덕양구 화정2동,중고,5,https://m.bunjang.co.kr/products/148977594?ref=%EC%B9%B4%ED%85%8C%EA%B3%A0%EB%A6%AC%EC%84%A0%ED%83%9D%EA%B2%B0%EA%B3%BC
849,148983503,1,라운드 랩 미니 원피스,여성의류,원피스,"15,000원",상세 설명 없음,인천광역시 서구 검단3동,중고,6,https://m.bunjang.co.kr/products/148983503?ref=%EC%B9%B4%ED%85%8C%EA%B3%A0%EB%A6%AC%EC%84%A0%ED%83%9D%EA%B2%B0%EA%B3%BC
850,149027087,1,여성 원피스,여성의류,원피스,"5,000원",예쁜 여성원피스 팔아요사이즈가 안맞아 판매해요기장85사이즈 55~55반,광주광역시 남구 송암동,중고,2,https://m.bunjang.co.kr/products/149027087?ref=%EC%B9%B4%ED%85%8C%EA%B3%A0%EB%A6%AC%EC%84%A0%ED%83%9D%EA%B2%B0%EA%B3%BC
851,149043607,1,스프링크로커스 원피스,여성의류,원피스,"80,000원",1회 시착만해서 새제품같아요~~사이즈가 커서 내놓습니다,,중고,2,https://m.bunjang.co.kr/products/149043607?ref=%EC%B9%B4%ED%85%8C%EA%B3%A0%EB%A6%AC%EC%84%A0%ED%83%9D%EA%B2%B0%EA%B3%BC
852,149052996,1,나시 원피스/끈원피스,여성의류,원피스,"28,000원",빈티지 끈원피스 입니다!빈티지이긴 하지만 택도 그대로 있어서 새상품이나 마찬가지입니다!한번도 안입었어요!👉새상품이지만 빈티지 특성 이해하시는분만 구매해주세요!👉교환.환불 ❌,전국,새상품,2,https://m.bunjang.co.kr/products/149052996?ref=%EC%B9%B4%ED%85%8C%EA%B3%A0%EB%A6%AC%EC%84%A0%ED%83%9D%EA%B2%B0%EA%B3%BC
853,149062991,1,라코스테 원피스,여성의류,원피스,"80,000원",라코스테 정품입니다사이즈 34 색상 남색입니당애눌가능하니 연락주세여상태 2번밖에 안 입었어요정가는 10만원 후반입니다ㅜ,서울특별시 마포구 염리동,중고,2,https://m.bunjang.co.kr/products/149062991?ref=%EC%B9%B4%ED%85%8C%EA%B3%A0%EB%A6%AC%EC%84%A0%ED%83%9D%EA%B2%B0%EA%B3%BC
854,149065174,1,빈티지 끈원피스,여성의류,원피스,"25,000원",빈티지 끈원피스 입니다!구매후 한번도 입지않았습니다!👉새상품이지만 빈티지 특성 이해하시는분만 구매해주세요!👉교환.환불 ❌,전국,새상품,2,https://m.bunjang.co.kr/products/149065174?ref=%EC%B9%B4%ED%85%8C%EA%B3%A0%EB%A6%AC%EC%84%A0%ED%83%9D%EA%B2%B0%EA%B3%BC
855,149068479,1,마르니 블라우스,여성의류,원피스,"300,000원",상세 설명 없음,경상남도 밀양시 삼랑진읍,중고,2,https://m.bunjang.co.kr/products/149068479?ref=%EC%B9%B4%ED%85%8C%EA%B3%A0%EB%A6%AC%EC%84%A0%ED%83%9D%EA%B2%B0%EA%B3%BC
856,149069168,1,샤넬 니트 원피스,여성의류,원피스,"500,000원",상세 설명 없음,경상남도 밀양시 삼랑진읍,중고,2,https://m.bunjang.co.kr/products/149069168?ref=%EC%B9%B4%ED%85%8C%EA%B3%A0%EB%A6%AC%EC%84%A0%ED%83%9D%EA%B2%B0%EA%B3%BC
857,149079857,1,럭키슈에뜨 원피스 36,여성의류,원피스,"85,000원",♡ 럭키슈에뜨 원피스♡ 사이즈 36♡ 5회 착용,전국,중고,7,https://m.bunjang.co.kr/products/149079857?ref=%EC%B9%B4%ED%85%8C%EA%B3%A0%EB%A6%AC%EC%84%A0%ED%83%9D%EA%B2%B0%EA%B3%BC
858,149098494,1,플라스틱아일랜드 원피스 새상품,여성의류,원피스,"21,000원",택배비 4000원입니다 ,서울특별시 종로구 혜화동,중고,7,https://m.bunjang.co.kr/products/149098494?ref=%EC%B9%B4%ED%85%8C%EA%B3%A0%EB%A6%AC%EC%84%A0%ED%83%9D%EA%B2%B0%EA%B3%BC
859,149157557,1,긴팔원피스& 반팔원피스& 니트롱치마,여성의류,원피스,"5,000원","귀여운땡땡이원피스랑 니트롱치마 같이 팝니다그리고 반팔원피스도 팔아요 원피스로 입어도 되고 키크신분들에겐 너무 짧으니까 바지입고 입어도됩니다.저는 참고로 168이고요 그냥원피스 형식으로 그냥 입고다녔었어요안에 금색으로비춰서 고급스러운 느낌과 귀여운 느낌이 동시에 드는 옷이예요하지만 지금은 이제 살이쪄서 불편해져서 못입겠더라구요땡땡이 원피스는 66이상은 못입을것같고요55 55반 ? 정도 입으실수 있을거같아요66도 들어가긴하는데 조금 타이트하실순있어요그리고 제 키에 니트 롱치마 길이는 종아리 살짝 덮는 정도예요 ~몸에 착 달라붙어서 몸매가 잘 들어나는옷이예요몸매가 좋으신분들이 있으면 딱일거같아요한두번밖에 안입어서 상태는 좋은편입니다!중고라서 물건에 큰 하자 없으면 교환, 환불은 어려운 점 이해 부탁드려요~다같이 구매하시면 12000원 택배비포함에 해드리고요따로 구매하시면 한벌 당 5000원에 판매합니다",경기도 군포시 군포2동,중고,7,https://m.bunjang.co.kr/products/149157557?ref=%EC%B9%B4%ED%85%8C%EA%B3%A0%EB%A6%AC%EC%84%A0%ED%83%9D%EA%B2%B0%EA%B3%BC
860,149166970,1,CALVIN KLEIN 캘빈클라인 정품 여성 벨벳 원피스 새상품,여성의류,원피스,"129,000원",캘빈클라인 정품 벨벳 벨티드 원피스 입니다 고급스런  퍼플버건디 색상이며 부드러운 벨벳원단에벨티드 디자인의 럭셔리해보이면서 정갈한 원피스입니다 미국 사이즈 4(55~66)미국사이즈 6(66~77)두가지 중 선택 가능하십니다 **스카프는 별도입니다     코디 스카프는 미국 Loft 실크스카프입니나     구매원하시면 3만원에 판매합니다,충청북도 청주시 흥덕구 오송읍,새상품,8,https://m.bunjang.co.kr/products/149166970?ref=%EC%B9%B4%ED%85%8C%EA%B3%A0%EB%A6%AC%EC%84%A0%ED%83%9D%EA%B2%B0%EA%B3%BC
861,149170930,1,남성드로즈 3종세트,여성의류,원피스,"42,000원","남성드로즈 3종세트3종 한세트 구성 (브랜드 박스 구성)색   상: 레드, 그린, 네이비사이즈:L (90~95)XL (100)2XL (105~110)원단Cotton 94% Poly 6%신축성 좋으며 착용감 퀄리티 뛰어난 제품입니다.정규품과 동일원단 사용*수입 완제품 ",대구광역시 동구 신암2동,새상품,8,https://m.bunjang.co.kr/products/149170930?ref=%EC%B9%B4%ED%85%8C%EA%B3%A0%EB%A6%AC%EC%84%A0%ED%83%9D%EA%B2%B0%EA%B3%BC
862,149174373,1,남성 테크팩세트,여성의류,원피스,"57,000원",테크팩세트색상  검정.회색사이즈  L 95~100 XL 100~105,대구광역시 동구 신암2동,새상품,5,https://m.bunjang.co.kr/products/149174373?ref=%EC%B9%B4%ED%85%8C%EA%B3%A0%EB%A6%AC%EC%84%A0%ED%83%9D%EA%B2%B0%EA%B3%BC
863,149184465,1,원피스 (하객패션,여성의류,원피스,"11,000원",55상태좋음요 구입가 12만원전 사계절 한번씩은 입었어요겨울엔 코트안에 입고 봄가을엔 가디건에 입고..벨트없이 입어도 뒷라인이 잡혀있어 날씬해보이고 앞모습은 시스루때문에  배가 가려집니다고급스러워 보여요환불 반품 안됩니다 다른물건 많으니 구경하고 가세용벨트는 그냥 코디 입니다  파는거 아닙니다사이즈  상태 다적어 놨으니 사실분만  챗주세요,경기도 성남시 수정구 태평2동,중고,6,https://m.bunjang.co.kr/products/149184465?ref=%EC%B9%B4%ED%85%8C%EA%B3%A0%EB%A6%AC%EC%84%A0%ED%83%9D%EA%B2%B0%EA%B3%BC
864,149211316,1,핏 존예 라코스테 원피스 s,여성의류,원피스,"30,000원",약간 구김있는데 핏되는 옷이라 입으면 구김 없어져요 !! s입니다 핏도 색도 너무 예쁜데 살쪄서 팔아요 ㅠ,서울특별시 영등포구 당산제2동,중고,5,https://m.bunjang.co.kr/products/149211316?ref=%EC%B9%B4%ED%85%8C%EA%B3%A0%EB%A6%AC%EC%84%A0%ED%83%9D%EA%B2%B0%EA%B3%BC
865,149246403,1,각1000원씩,여성의류,원피스,"1,000원",저렴하게 가져가세요,,중고,3,https://m.bunjang.co.kr/products/149246403?ref=%EC%B9%B4%ED%85%8C%EA%B3%A0%EB%A6%AC%EC%84%A0%ED%83%9D%EA%B2%B0%EA%B3%BC
866,149249303,1,후아유 루즈핏 롱 기모 후드 원피스,여성의류,원피스,"6,000원",한번 시착했어요 ㅠ 길이가 저한텐 조금긴것 같아 내놓습니다 ,서울특별시 중구 명동,중고,5,https://m.bunjang.co.kr/products/149249303?ref=%EC%B9%B4%ED%85%8C%EA%B3%A0%EB%A6%AC%EC%84%A0%ED%83%9D%EA%B2%B0%EA%B3%BC
867,149260758,1,리리앤코 스트라이프 벨트 원피스,여성의류,원피스,"15,000원","리리앤코에서 산 현재는 품절된 원피스에요사이즈는 66-77반까지도 잘맞아요몇번 안입구 깨끗하게 입어서 상태 좋아용💙쿨거 부탁 드립니다~교환x, 환불x, 택배비 미포함입니다#육육걸즈 #디데이걸 #썸데이즈 #고고싱 #리리앤코 #데쥬 #밀크코코아 #메이윤 ",부산광역시 연제구 연산제8동,중고,2,https://m.bunjang.co.kr/products/149260758?ref=%EC%B9%B4%ED%85%8C%EA%B3%A0%EB%A6%AC%EC%84%A0%ED%83%9D%EA%B2%B0%EA%B3%BC
868,149269973,1,로미스토리 와인색 나시 원피스.,여성의류,원피스,"12,000원","찔러보기X 확실한 구입의사 있으신분만 연락주세요 택배 착불우대, 선불시 4000원택도 안뗀 새상품34000원에 구매",전국,새상품,3,https://m.bunjang.co.kr/products/149269973?ref=%EC%B9%B4%ED%85%8C%EA%B3%A0%EB%A6%AC%EC%84%A0%ED%83%9D%EA%B2%B0%EA%B3%BC
869,149287378,1,"신민아,신재은 원피스 앤아더스토리즈 새상품!",여성의류,원피스,"91,000원",새상품이고 시착만 해봤어요! 신민아님과 신재은님이 입어서 완판된 원피스입니다 스몰사이즈,서울특별시 영등포구 당산제2동,새상품,4,https://m.bunjang.co.kr/products/149287378?ref=%EC%B9%B4%ED%85%8C%EA%B3%A0%EB%A6%AC%EC%84%A0%ED%83%9D%EA%B2%B0%EA%B3%BC
870,149295247,1,연청 멜빵 원피스 L,여성의류,원피스,"10,000원",시착 한 번 하고 보관만했어요! 상태 좋고 색도 예뻐요 방정리하면서 올리는거여서 안팔리면 글 내려요ㅠㅠ✔️이사준비중이라서 교환은 받지않아요 ✔️배송비는 +3500원 입니다,전국,새상품,1,https://m.bunjang.co.kr/products/149295247?ref=%EC%B9%B4%ED%85%8C%EA%B3%A0%EB%A6%AC%EC%84%A0%ED%83%9D%EA%B2%B0%EA%B3%BC
871,149295449,1,(브라운) 카라 스트링 원피스 / 바온빈블러브앤드팝녕이옷장미녕옷장웨어드롭,여성의류,원피스,"25,000원",한번착용 세탁완료봄에 입기 좋아요💛,전국,중고,6,https://m.bunjang.co.kr/products/149295449?ref=%EC%B9%B4%ED%85%8C%EA%B3%A0%EB%A6%AC%EC%84%A0%ED%83%9D%EA%B2%B0%EA%B3%BC
872,149296079,1,리본 랩원피스,여성의류,원피스,"20,000원",1-2회 착용한 상태 양호한 원피스예요~ 옷이 많아 정리합니다~ 이거 입으면 몸에 찰싹 붙는 핏이라 몸매 이뻐 보여요~ 여리여리 하면서 은근 섹시한 느낌이 나영~ #데이트룩#파티룩#밀크코코아#랩원피스사이즈  55 택배 3000교환.환불 no,경기도 수원시 영통구 원천동,중고,6,https://m.bunjang.co.kr/products/149296079?ref=%EC%B9%B4%ED%85%8C%EA%B3%A0%EB%A6%AC%EC%84%A0%ED%83%9D%EA%B2%B0%EA%B3%BC
873,149296472,1,leshop 르샵 꽃무늬 반팔 원피스,여성의류,원피스,"40,000원",시착만 한 번 해보고 보관해서 상태 좋아요 텍도 그대로 달려있습니다 프리사이즈에요방정리하면서 올리는거여서 안팔리면 글 내려요ㅠㅠ✔️이사준비중이라서 교환은 받지않아요 ✔️배송비는 +3500원 입니다,전국,새상품,4,https://m.bunjang.co.kr/products/149296472?ref=%EC%B9%B4%ED%85%8C%EA%B3%A0%EB%A6%AC%EC%84%A0%ED%83%9D%EA%B2%B0%EA%B3%BC
874,149310530,1,미쏘니,여성의류,원피스,"200,000원",,전국,중고,3,https://m.bunjang.co.kr/products/149310530?ref=%EC%B9%B4%ED%85%8C%EA%B3%A0%EB%A6%AC%EC%84%A0%ED%83%9D%EA%B2%B0%EA%B3%BC
875,149367685,1,랩 원피스,여성의류,원피스,"25,000원",한번 입었어요 랩 원피스입니다!,경기도 부천시 심곡2동,중고,5,https://m.bunjang.co.kr/products/149367685?ref=%EC%B9%B4%ED%85%8C%EA%B3%A0%EB%A6%AC%EC%84%A0%ED%83%9D%EA%B2%B0%EA%B3%BC
876,149367746,1,원피스,여성의류,원피스,"30,000원",오프라인 매장에서 오만원대에 구매했어요딱 한번 입었는데 살쪄 못입게 돼서 팝니다 ㅠㅠ 진짜 이뿐데... 팔부분은 시스루에요 키 158에 정강이 반 덮어요,경기도 부천시 심곡2동,중고,5,https://m.bunjang.co.kr/products/149367746?ref=%EC%B9%B4%ED%85%8C%EA%B3%A0%EB%A6%AC%EC%84%A0%ED%83%9D%EA%B2%B0%EA%B3%BC
877,149377519,1,뷔스티에원피스,여성의류,원피스,"3,000원",뷔스티에 원피스입니다~안에 티나 블라우스랑 입으면 정말 예뻐요!어깨부분에 링으로 묶여있어 포인트가 될 수 있고 길이 조절 가능해요. 안에 안감은 없습니다~총길이: 어깨끈제외 72가슴둘레: 44배송비는 3천원입니다.,경기도 수원시 팔달구 매산동,중고,3,https://m.bunjang.co.kr/products/149377519?ref=%EC%B9%B4%ED%85%8C%EA%B3%A0%EB%A6%AC%EC%84%A0%ED%83%9D%EA%B2%B0%EA%B3%BC
878,149377735,1,니트원피스,여성의류,원피스,"3,000원","니트 원피스입니다~겨울에 레이어드해서 입어도 예쁘고 봄,가을에 단품으로 입어도 예뻐요!몇번 입지 않아 보풀감 없고 상태 좋아요~가슴둘레: 59총길이: 90택배비는 3천원입니다.",경기도 수원시 팔달구 매산동,중고,2,https://m.bunjang.co.kr/products/149377735?ref=%EC%B9%B4%ED%85%8C%EA%B3%A0%EB%A6%AC%EC%84%A0%ED%83%9D%EA%B2%B0%EA%B3%BC
879,149416573,1,쉬폰원피스(빈티지),여성의류,원피스,"28,000원",❤️땡땡이 빈티지 쉬폰원피스❤️.빈티지샵에서 구매했고 구매후 한번도 입지않았습니다!리본이랑 땡땡이 무늬가 진짜 귀여워요!!😆택배비+3000👉빈티지 특성 이해하시는분만 구매해주세요!👉교환.환불 ❌,전국,중고,2,https://m.bunjang.co.kr/products/149416573?ref=%EC%B9%B4%ED%85%8C%EA%B3%A0%EB%A6%AC%EC%84%A0%ED%83%9D%EA%B2%B0%EA%B3%BC
