,img_id,number,title,category_big,category_mid,price,detail,region,status,file_count,url
1239,151816091,1,메리 골지 원피스,여성의류,원피스,"35,000원","<<구매하실때 원하시는 색상을 반드시 번개톡으로 문의 주세요:)>>본 상품은 번개페이로 구매해주시면 CJ택배를 이용 선불 발송해 드립니다:)더많은 여성복 의류를 구경하시기를 원하시면 구글에서 ""벨르스토어""를 검색해보세요:)**벨르스토어 20~21 시즌오프 세일 상품 반짝 프로모션*상품명: 메리 골지 원피스정상 판매가: 54,000(배송비 포함)반짝 프로모션가: 35,000원(배송비 포함)#보유 재고 정보(20210417토요일 현재)연베이지, Free 사이즈: 1장크림, Free 사이즈: 1장MD COMMENT #느낌울 70%, 나일론 21%, 폴리 9%로 제작된 골지 원피스에요2020년 겨울 시즌을 위해제작되었어요아우터와 같이 활용하실때이너로 편안하게 활용해보세요!정말로 돋보이는 스타일 연출이가능하실거에요:)#SIZE컬러 : 크림, 연베이지, 진베이지, 그레이, 블랙총 기장 : 118 CM품 : 50 CM어깨 : 33.5 CM소매기장 : 62CM",서울특별시 종로구 창신제1동,새상품,6,https://m.bunjang.co.kr/products/151816091?ref=%EC%B9%B4%ED%85%8C%EA%B3%A0%EB%A6%AC%EC%84%A0%ED%83%9D%EA%B2%B0%EA%B3%BC
1240,151816101,1,로젤린 랩원피스,여성의류,원피스,"43,000원","다시는 여름쿨톤이 검은색을 넘보지 않겠습니다,, 다른 분들 후기 사진이 너무 예뻐서 안어울릴거 알면서 억지로 구매했는데 역시 얼굴 전체가 흑빛이 되네요 한번도 못입고 고민만 하다가 결국 올립니다 ㅠㅠ 검은색 어울리는 분들 거둬가주세요! 지금보다 더 더운 늦봄에 입기 딱 좋은 야들야들한 면이에요 전체적으로 여리여리한 느낌에 밑트임 있어요! 집앞마실룩으로 딱인거같아요49000 -> 43000 +반값1600",광주광역시 동구 학동,중고,5,https://m.bunjang.co.kr/products/151816101?ref=%EC%B9%B4%ED%85%8C%EA%B3%A0%EB%A6%AC%EC%84%A0%ED%83%9D%EA%B2%B0%EA%B3%BC
1241,151816673,1,크리스틴 로어 기모 후드 원피스,여성의류,원피스,"24,000원","<<구매하실때 원하시는 색상을 반드시 번개톡으로 문의 주세요:)>>본 상품은 번개페이로 구매해주시면 CJ택배를 이용 선불 발송해 드립니다:)더많은 여성복 의류를 구경하시기를 원하시면 구글에서 ""벨르스토어""를 검색해보세요:)**벨르스토어 20~21 시즌오프 세일 상품 반짝 프로모션*상품명: 크리스틴 로어 기모 후드 원피스정상 판매가: 31,770원(배송비 포함)반짝 프로모션가: 24,000원(배송비 포함) #보유 재고 정보(20210417토요일 현재)그레이, Free 사이즈: 1장MD COMMENT #느낌면65%, 폴리35%로 제작된 핸드메이드 기모 원피스에요2020년 겨울 시즌을 위해제작되었어요루즈핏으로 편안하게입을수 있는 기능성에 초점을 두었어요물론, 스타일 연출은 다양하게가능하세요!#SIZE컬러 : 크림, 오트밀, 그레이, 브라운, 블랙  어깨54가슴59소매통19소매기장53총기장113 ",서울특별시 종로구 창신제1동,새상품,12,https://m.bunjang.co.kr/products/151816673?ref=%EC%B9%B4%ED%85%8C%EA%B3%A0%EB%A6%AC%EC%84%A0%ED%83%9D%EA%B2%B0%EA%B3%BC
1242,151826427,1,zara 자라 데님원피스,여성의류,원피스,"40,000원","zara신상 데님원피스 (m)자라 매장에서 59,000원주고 샀어요여행가서 딱 한번 입었습니다~!입고찍은 사진 올리니 주변에서 다들 너무 예쁘다고 말 많이 나왔던 원피스에요!오염,하자 없이 깨끗해요 :)",부산광역시 북구 화명제1동,중고,6,https://m.bunjang.co.kr/products/151826427?ref=%EC%B9%B4%ED%85%8C%EA%B3%A0%EB%A6%AC%EC%84%A0%ED%83%9D%EA%B2%B0%EA%B3%BC
1243,151844840,1,비비안웨스트우드 원피스,여성의류,원피스,"45,000원",빈티지제품으로 정가품유무는 알수가없어요교환 환불은 어려워용 🙅🏻🙅🏻배송비는 무료입니당💕판매자스펙 (169/53)🌹,경기도 시흥시 신천동,중고,5,https://m.bunjang.co.kr/products/151844840?ref=%EC%B9%B4%ED%85%8C%EA%B3%A0%EB%A6%AC%EC%84%A0%ED%83%9D%EA%B2%B0%EA%B3%BC
1244,151848669,1,뷔스티에티,여성의류,원피스,"10,000원",43 가슴 53밑단 ,서울특별시 송파구 가락2동,중고,4,https://m.bunjang.co.kr/products/151848669?ref=%EC%B9%B4%ED%85%8C%EA%B3%A0%EB%A6%AC%EC%84%A0%ED%83%9D%EA%B2%B0%EA%B3%BC
1245,151853888,1,짐머만스타일 원피스/럭셔리 원피스/플아워패턴원피스/쉬폰원피스,여성의류,원피스,"30,000원","2년전에 일본편집셥에서 구입한 원피스입니다.디테일 보시면 아시겠지만 진짜 퀄리티 좋고 고급스러운원피스입니다 .화려하고 전문 공주공주한 스타일 레이스한 스타일 파는 디자이너 편집샵에서 한화약28만원에 구입했어요.딱한번입고 사진찍은게 다라 상태굿입니다.이염 ,하자 없어요.검정리본은 허리띠 혹 카라리본으로 사용가능합니다.브로치는 제가 따로 맞춘거예요.더 고급서러워 보입니다.바로 쿨거시 같이 챙겨드릴게요.저는 모든 상품 한번사용하면 바로 질리는 스타일이라 그냥 다 싸게 내놓아요~득템하세요.에눌문의 답장안합니다택비별도(직거래 가능)중고상품 특성상 교환,환불 안됩니다",서울특별시 중구 황학동,중고,12,https://m.bunjang.co.kr/products/151853888?ref=%EC%B9%B4%ED%85%8C%EA%B3%A0%EB%A6%AC%EC%84%A0%ED%83%9D%EA%B2%B0%EA%B3%BC
1246,151855229,1,에스닉한 롱원피스,여성의류,원피스,"29,000원",66사이즈까지만됩니다^^♡랩원피스에요느낌만보시라고 다른색상도올려요실사있어요새상품이고 배송비는 3500원별도입니다,대전광역시 대덕구 비래동,새상품,7,https://m.bunjang.co.kr/products/151855229?ref=%EC%B9%B4%ED%85%8C%EA%B3%A0%EB%A6%AC%EC%84%A0%ED%83%9D%EA%B2%B0%EA%B3%BC
1247,151858574,1,쥬지쥬디원피스신상주말한정특가,여성의류,원피스,"72,000원",쥬시쥬디신상원피스 66사이즈에요~ 구매후 고민하다 교환시기놓쳐 올려보네요~ 색감너무예쁘고 입으면 훨씬예쁜아이에요~ 시착만해본 텍잇는새상품입니다~ 안감없어요~반품환불X  신축성잇어요   요즘요런스탈 대세죠~~,충청남도 천안시 동남구 신안동,새상품,4,https://m.bunjang.co.kr/products/151858574?ref=%EC%B9%B4%ED%85%8C%EA%B3%A0%EB%A6%AC%EC%84%A0%ED%83%9D%EA%B2%B0%EA%B3%BC
1248,151862958,1,미국명품브랜드 MAGGY LONDON 원피스,여성의류,원피스,"135,000원",미국명품브랜드 매기런던 스판 미디원피스 새상품 톤다운된 예쁜 레드 컬러이며 목부분 리본과 셔링 어깨가 포인트로 살짝 하이웨이스트 디자인으로 너무 날씬해보이는 핏입니다 160기준 무릎을 덮는 미디 기장이며 신축성있는 원단입니다 신축성이 좋아 66반까지 충분히 가능하십니다 ,충청북도 청주시 흥덕구 오송읍,새상품,7,https://m.bunjang.co.kr/products/151862958?ref=%EC%B9%B4%ED%85%8C%EA%B3%A0%EB%A6%AC%EC%84%A0%ED%83%9D%EA%B2%B0%EA%B3%BC
1249,151863109,1,미국명품브랜드 캘빈클라인 정품 럭셔리 원피스,여성의류,원피스,"135,000원",미국명품브랜드 캘빈클라인 정품 럭셔리 원피스 새상품으로 러블리한 셔링 팔부소매가 포인트인 심플하면서도 고급진 고쿼리티 원피스 입니다 연한  핑크빛이 감도는 아이보리 톤이며신축성있는 원단으로 날씬77까지 잘맞으실겁니다,충청북도 청주시 흥덕구 오송읍,새상품,7,https://m.bunjang.co.kr/products/151863109?ref=%EC%B9%B4%ED%85%8C%EA%B3%A0%EB%A6%AC%EC%84%A0%ED%83%9D%EA%B2%B0%EA%B3%BC
1250,151863247,1,미국명품브랜드 빈스까뮤또 정품 저지원피스,여성의류,원피스,"129,000원",미국명품브랜드 빈스까뮤또 정품 저지원피스 새상품으로 구김가지않고 신축성있는 원단으로 편하게 입을수있는 멎진 원피스 입니다 칠부소매로 팔이 가늘어 보이고 네크 라인이 굉장히 여성스러워보이는 러블리한 원피스 입니다 55~66반까지 잘맞으실겁니다,충청북도 청주시 흥덕구 오송읍,새상품,8,https://m.bunjang.co.kr/products/151863247?ref=%EC%B9%B4%ED%85%8C%EA%B3%A0%EB%A6%AC%EC%84%A0%ED%83%9D%EA%B2%B0%EA%B3%BC
1251,151864084,1,르꼴레뜨 정품 플레어 원피스 새상품,여성의류,원피스,"49,000원",르꼴레뜨 정품 팔부소매 정장원피스 66  새상품 에이라인핏의 예쁜 플레어 원피스 입니다 총기장 89정도,충청북도 청주시 흥덕구 오송읍,새상품,5,https://m.bunjang.co.kr/products/151864084?ref=%EC%B9%B4%ED%85%8C%EA%B3%A0%EB%A6%AC%EC%84%A0%ED%83%9D%EA%B2%B0%EA%B3%BC
1252,151871240,1,쥬시쥬디후드원피스주말특가,여성의류,원피스,"39,000원",쥬시쥬디후드원피스 66사이즈에요~편하게 입기좋고 프린트가잇어 칙칙하지않고 예쁜아이에요~ 신상이고 시착만해본  새상품이에용~ 반품환불X  주머니도 잇어요,충청남도 천안시 동남구 신안동,중고,4,https://m.bunjang.co.kr/products/151871240?ref=%EC%B9%B4%ED%85%8C%EA%B3%A0%EB%A6%AC%EC%84%A0%ED%83%9D%EA%B2%B0%EA%B3%BC
1253,151880274,1,잇미샤 레이스 원피스,여성의류,원피스,"120,000원","잇미샤 레이스원피스 판매합니다.(구매가 20만원 초반)구매 후 단 2회 착용하여 상태 매우 좋습니다.사이즈 55이며 키 158기준 무릎 살짝 위 기장이에요!마지막사진 레몬색보다는 서현이 입고있는 개나리색에 가깝습니다~!택포 120,000원",전국,중고,3,https://m.bunjang.co.kr/products/151880274?ref=%EC%B9%B4%ED%85%8C%EA%B3%A0%EB%A6%AC%EC%84%A0%ED%83%9D%EA%B2%B0%EA%B3%BC
1254,151886887,1,써스데이아일랜드 뷔스티에 롱원피스/55~66,여성의류,원피스,"59,000원","새옷 수준가슴단면 50cm/ 길이 120cm/ 55~66허리 옆 끈리본으로 핏 조절✅ 실측 꼭꼭 확인해 주세요! 사이즈 미스로 교환, 환불 안됩니다!✅ 빈티지 특성상 미처 발견하지 못한 오염, 하자가 있을 수 있는 점을 이해하시는 분만 구입해 주세요!✅ 환불, 반품 안되니 사진 자세히 확대해서 보시고, 질문도 많이 하시고 신중히 결정해 주세요!",전국,중고,9,https://m.bunjang.co.kr/products/151886887?ref=%EC%B9%B4%ED%85%8C%EA%B3%A0%EB%A6%AC%EC%84%A0%ED%83%9D%EA%B2%B0%EA%B3%BC
1255,151889937,1,커먼유니크 원피스(사나원피스),여성의류,원피스,"30,000원",시착 한번하고 한번도 안입었습니다!!짧은 버전입니다😊🍒벼룩🍒📦택배비3500벼룩 특성상 교환/환불 절대불가 입니다,대전광역시 동구 효동,새상품,1,https://m.bunjang.co.kr/products/151889937?ref=%EC%B9%B4%ED%85%8C%EA%B3%A0%EB%A6%AC%EC%84%A0%ED%83%9D%EA%B2%B0%EA%B3%BC
1256,151895173,1,블루체크나시원피스,여성의류,원피스,"10,000원",입으면 귀엽고 이뻐요 면재질이라 부들부들하고 빨아도 모양변형이 없습니다☆흰블라우스나 하늘색 티에 입으먄 예뻐요 허리둘레 38총 길이 82 ,경기도 용인시 기흥구 상하동,중고,3,https://m.bunjang.co.kr/products/151895173?ref=%EC%B9%B4%ED%85%8C%EA%B3%A0%EB%A6%AC%EC%84%A0%ED%83%9D%EA%B2%B0%EA%B3%BC
1257,151901597,1,미샤머메이드원피스,여성의류,원피스,"225,000원",66사이즈시착만한 새 상품입니다.오피스룩으로 구입했는데 좀 튀는것 같아서 판매해요.스키프하나 하고 입으면 옷은 너무너무 예뻐요.,전국,중고,2,https://m.bunjang.co.kr/products/151901597?ref=%EC%B9%B4%ED%85%8C%EA%B3%A0%EB%A6%AC%EC%84%A0%ED%83%9D%EA%B2%B0%EA%B3%BC
1258,151903248,1,리넨원피스,여성의류,원피스,"5,000원",옷 입는 스타일이 바뀌어서 팔아요~ 택비 별도허리끈 있어요,경기도 군포시 궁내동,중고,2,https://m.bunjang.co.kr/products/151903248?ref=%EC%B9%B4%ED%85%8C%EA%B3%A0%EB%A6%AC%EC%84%A0%ED%83%9D%EA%B2%B0%EA%B3%BC
1259,151906042,1,"원피스,스커트셋",여성의류,원피스,"10,000원","1번 화이트오프숄더 윈피스2~4번  나시 스커트 셋트2,3번 스커트는 뒷벤딩지퍼로 되어있구요4번 스커트는 스트랩롱 스커트입니다새 상품이에요. 집에서만 한번씩 입어본 상품입니다셋트당 10000원택비별도입니다 3000원 교환 환불 반품은 안돼요^^",전국,중고,4,https://m.bunjang.co.kr/products/151906042?ref=%EC%B9%B4%ED%85%8C%EA%B3%A0%EB%A6%AC%EC%84%A0%ED%83%9D%EA%B2%B0%EA%B3%BC
1260,151919823,1,원피스,여성의류,원피스,"33,000원",7만원대 구매실착용 1회가디건 위에 걸칠 수 있게 드림가디건은 새제품,전라남도 광양시 중마동,중고,3,https://m.bunjang.co.kr/products/151919823?ref=%EC%B9%B4%ED%85%8C%EA%B3%A0%EB%A6%AC%EC%84%A0%ED%83%9D%EA%B2%B0%EA%B3%BC
1261,151920543,1,파스텔타임 셔츠 원피스,여성의류,원피스,"10,000원",어깨 39/ 소매 59/ 총기장 85.5 ,전라북도 전주시 덕진구 송천1동,중고,2,https://m.bunjang.co.kr/products/151920543?ref=%EC%B9%B4%ED%85%8C%EA%B3%A0%EB%A6%AC%EC%84%A0%ED%83%9D%EA%B2%B0%EA%B3%BC
1262,151921738,1,미니 원피스,여성의류,원피스,"30,000원",새상품,인천광역시 서구 검단4동,중고,1,https://m.bunjang.co.kr/products/151921738?ref=%EC%B9%B4%ED%85%8C%EA%B3%A0%EB%A6%AC%EC%84%A0%ED%83%9D%EA%B2%B0%EA%B3%BC
1263,151922444,1,미니원피스,여성의류,원피스,"30,000원",새거,인천광역시 서구 검단4동,중고,1,https://m.bunjang.co.kr/products/151922444?ref=%EC%B9%B4%ED%85%8C%EA%B3%A0%EB%A6%AC%EC%84%A0%ED%83%9D%EA%B2%B0%EA%B3%BC
1264,151931426,1,샤트렌 원피스 100사이즈,여성의류,원피스,"22,000원","-샤트렌-여름 원피스-100사이즈-총기장 94cm-상태 깨끗-중고거래상 교환,환불X",전국,중고,4,https://m.bunjang.co.kr/products/151931426?ref=%EC%B9%B4%ED%85%8C%EA%B3%A0%EB%A6%AC%EC%84%A0%ED%83%9D%EA%B2%B0%EA%B3%BC
1265,151944424,1,미니원피스 55,여성의류,원피스,"5,000원","새제품 ..  여성 55샤쥬 !!총기장 80, 반품 44.에눌,교신 미리 죄송 🙏🏻🙏🏻",경기도 하남시 미사1동,새상품,3,https://m.bunjang.co.kr/products/151944424?ref=%EC%B9%B4%ED%85%8C%EA%B3%A0%EB%A6%AC%EC%84%A0%ED%83%9D%EA%B2%B0%EA%B3%BC
1266,151944710,1,르샵 미니 원피스 (새상품),여성의류,원피스,"6,000원","새제품!!사이즈 S (55)에눌,교신, 반품 미리죄송 🙏🏻🙏🏻",경기도 하남시 미사1동,새상품,4,https://m.bunjang.co.kr/products/151944710?ref=%EC%B9%B4%ED%85%8C%EA%B3%A0%EB%A6%AC%EC%84%A0%ED%83%9D%EA%B2%B0%EA%B3%BC
1267,151945116,1,자라 원피스,여성의류,원피스,"50,000원",자라 원피스 (55사이즈)금요일 구매 후 한번 착용 원가 59000,전국,중고,1,https://m.bunjang.co.kr/products/151945116?ref=%EC%B9%B4%ED%85%8C%EA%B3%A0%EB%A6%AC%EC%84%A0%ED%83%9D%EA%B2%B0%EA%B3%BC
1268,151949541,1,플라워페인팅 원피스,여성의류,원피스,"10,000원",여행가서 입으려고 구매했던 원피스 입니다실착 2회컨디션 최상입니다허리부분에 셔링이 있어서 몸매를 잡아줘 날씬하게 보입니다164cm기준 무릎 밑까지 내려와요~ 컬러는 아주 연한 보랏빛이 돌아요! ,대구광역시 동구 지저동,중고,3,https://m.bunjang.co.kr/products/151949541?ref=%EC%B9%B4%ED%85%8C%EA%B3%A0%EB%A6%AC%EC%84%A0%ED%83%9D%EA%B2%B0%EA%B3%BC
1269,151951101,1,블랙 시스루 원피스,여성의류,원피스,"5,000원","길이 88.5cm상태 새상품입니다. 저한테 너무 짧아서시도를 못 했어요.반값택배 1600기본택배 서울/경기 2600, 그 외 3100",서울특별시 동대문구 청량리동,새상품,2,https://m.bunjang.co.kr/products/151951101?ref=%EC%B9%B4%ED%85%8C%EA%B3%A0%EB%A6%AC%EC%84%A0%ED%83%9D%EA%B2%B0%EA%B3%BC
1270,151951330,1,마크들리 원피스,여성의류,원피스,"68,000원",배송받고 시착만 해본 상품이에요ㅜㅜ안어울리는거같아서 내놔요ㅜㅜ,전국,중고,2,https://m.bunjang.co.kr/products/151951330?ref=%EC%B9%B4%ED%85%8C%EA%B3%A0%EB%A6%AC%EC%84%A0%ED%83%9D%EA%B2%B0%EA%B3%BC
1271,151953348,1,뒷트임 롱 원피스 /밴딩 원피스,여성의류,원피스,"5,000원",뒷트임 롱 원피스 /밴딩 원피스(1회착용)총기장:109cm*교환/환불은 불가능합니다ㅠㅠ,서울특별시 송파구 잠실2동,중고,4,https://m.bunjang.co.kr/products/151953348?ref=%EC%B9%B4%ED%85%8C%EA%B3%A0%EB%A6%AC%EC%84%A0%ED%83%9D%EA%B2%B0%EA%B3%BC
1272,151954346,1,[무료배송]핫핑 꿈같은 만남 플라워 롱 원피스 2사이즈 66~77,여성의류,원피스,"12,000원","사놓고 1번 ? 그정도 입고 안어울려서 못입었던 옷이라 상태 좋습니다! 속치마도 내장되어있고, 재질도 좋아요!@ 꽃놀이갈때 입으시면 딱입니다!! 살때 배미포 27800원에 샀는데 배송비포함 12000원에 올려요ㅜㅜ어울리는분!! 얼른 사가시길바래요!:)",경상북도 칠곡군 북삼읍,중고,3,https://m.bunjang.co.kr/products/151954346?ref=%EC%B9%B4%ED%85%8C%EA%B3%A0%EB%A6%AC%EC%84%A0%ED%83%9D%EA%B2%B0%EA%B3%BC
1273,151959092,1,린넨와이드 투피스 세트,여성의류,원피스,"13,000원",한번입었습니다린넨이라 편하고 시원해요!!,경기도 의정부시 의정부1동,중고,1,https://m.bunjang.co.kr/products/151959092?ref=%EC%B9%B4%ED%85%8C%EA%B3%A0%EB%A6%AC%EC%84%A0%ED%83%9D%EA%B2%B0%EA%B3%BC
1274,151960360,1,자라 데님 멜빵치마s,여성의류,원피스,"15,000원",부드러운 빈티지 데님이라 여름에도 착용 가능합니다 165기준 무릎정도 오고 사이즈 스몰이에요 ,부산광역시 영도구 청학제2동,중고,2,https://m.bunjang.co.kr/products/151960360?ref=%EC%B9%B4%ED%85%8C%EA%B3%A0%EB%A6%AC%EC%84%A0%ED%83%9D%EA%B2%B0%EA%B3%BC
1275,151968142,1,지고트원피스 66,여성의류,원피스,"33,000원",지고트 원피스 66한번 입고 보관중이라 상태 좋아요아이보리색상  여성스럽고 예쁩니다♡,경기도 성남시 분당구 이매2동,중고,2,https://m.bunjang.co.kr/products/151968142?ref=%EC%B9%B4%ED%85%8C%EA%B3%A0%EB%A6%AC%EC%84%A0%ED%83%9D%EA%B2%B0%EA%B3%BC
1276,151968263,1,프롬데이원 로엔 하이타이 원피스,여성의류,원피스,"32,000원",한번 입었어요 m 사이즈입니다!,인천광역시 남동구 논현1동,중고,3,https://m.bunjang.co.kr/products/151968263?ref=%EC%B9%B4%ED%85%8C%EA%B3%A0%EB%A6%AC%EC%84%A0%ED%83%9D%EA%B2%B0%EA%B3%BC
1277,151976159,1,어깨패드 셔링 크롭 투피스,여성의류,원피스,"25,000원",시착하고 옷장에만 넣어놨어요조명이랑 대충찍어서 그런데모델사진이랑 똑같은 옷이에요상의는 어깨패드 크롭 맨투맨티하의는 기장조절가능한 셔링이에요카키색상 초록느낌 카키에요씨유택배 3500구매하실분만 제발 연락주세요~제돈주고 제가산거에여..사업자아닙니당중고상품 특성상 교환 환불 안됩니다!!!제발 매너좀 지켜주세요...저렴하게 올린거라 에눌안됩니다중고 예민하신분들은 피해주세요,부산광역시 사상구 엄궁동,중고,6,https://m.bunjang.co.kr/products/151976159?ref=%EC%B9%B4%ED%85%8C%EA%B3%A0%EB%A6%AC%EC%84%A0%ED%83%9D%EA%B2%B0%EA%B3%BC
1278,151977643,1,새상품 베이지 트렌치 원피스 에이블리 지그재그,여성의류,원피스,"10,000원",베이지 원피스 입니다~!허리선이 높아서 다리가 길어보여요새상품입니다!판매자상품 두개이상구매시 무료배송그외 배송비 추가 ,서울특별시 구로구 오류제2동,중고,1,https://m.bunjang.co.kr/products/151977643?ref=%EC%B9%B4%ED%85%8C%EA%B3%A0%EB%A6%AC%EC%84%A0%ED%83%9D%EA%B2%B0%EA%B3%BC
1279,151987487,1,시스루원피스(택만제거),여성의류,원피스,"15,000원",시스루망사원피스입니다사이즈55(s)입니다택만 제거했고 집에서 시착만하고옷장안에 보관만해서상태는 새옷이라보시면되요.섹시하고 가슴쪽 브라캡 내장되어있어서허리와 가슴잡아줍니다.색상곤색입니다,서울특별시 성동구 마장동,중고,3,https://m.bunjang.co.kr/products/151987487?ref=%EC%B9%B4%ED%85%8C%EA%B3%A0%EB%A6%AC%EC%84%A0%ED%83%9D%EA%B2%B0%EA%B3%BC
1280,151989391,1,듀엘 쉬폰 원피스,여성의류,원피스,"200,000원",한 번 입고 다녔어요!사이즈는 55고 상태 완전 새 옷이나 마찬가지입니당에눌 되니 편하게 연락 주세요!!,경상북도 포항시 북구 양학동,중고,4,https://m.bunjang.co.kr/products/151989391?ref=%EC%B9%B4%ED%85%8C%EA%B3%A0%EB%A6%AC%EC%84%A0%ED%83%9D%EA%B2%B0%EA%B3%BC
1281,151998750,1,베이지 원피스,여성의류,원피스,"9,000원",재질이나 핏 색감 다 넘넘 이뻐요편하게 입으면서 꾸안꾸느낌 낼수있어요💕하자x 상태 좋습니다,경기도 파주시 교하동,중고,5,https://m.bunjang.co.kr/products/151998750?ref=%EC%B9%B4%ED%85%8C%EA%B3%A0%EB%A6%AC%EC%84%A0%ED%83%9D%EA%B2%B0%EA%B3%BC
1282,152016189,1,(옷장정리) 스퀘어넥 체크원피스,여성의류,원피스,"8,000원",오프라인에서 구매하고 2회정도 착용스커트 쪽에 작은 얼룩 있는데 세탁하면 지워질 듯 해요.안감없는데 비치진 않음44-55사이즈 입는 분들 착용 가능원가 : 정확히 기억 안나는데 2만 중~후반이었던 거 같음판가 : 8000원 (배송비 별도 / 편의점 택배)얼룩 외 하자 없지만 옷장에 걸어둬서 옷장 냄새 밸 수 있고기타 실밥이나 구김 등 있을 수 있어요.궁금하신 점은 번톡주세요~,경상남도 김해시 주촌면,중고,8,https://m.bunjang.co.kr/products/152016189?ref=%EC%B9%B4%ED%85%8C%EA%B3%A0%EB%A6%AC%EC%84%A0%ED%83%9D%EA%B2%B0%EA%B3%BC
1283,152026012,1,오늘하루만 개당천원 !!!,여성의류,원피스,"1,000원",입금순으로 판매됩니다 오늘하루만 천원,인천광역시 서구 검단4동,중고,1,https://m.bunjang.co.kr/products/152026012?ref=%EC%B9%B4%ED%85%8C%EA%B3%A0%EB%A6%AC%EC%84%A0%ED%83%9D%EA%B2%B0%EA%B3%BC
1284,152030902,1,퍼스트제이 원피스,여성의류,원피스,"20,000원",구매하구 몇번 입지 않았습니다 상태 좋음 프리사이즈 총장 113cm택배 3000원 cu반값택배 가능,서울특별시 광진구 자양제4동,중고,3,https://m.bunjang.co.kr/products/152030902?ref=%EC%B9%B4%ED%85%8C%EA%B3%A0%EB%A6%AC%EC%84%A0%ED%83%9D%EA%B2%B0%EA%B3%BC
1285,152035615,1,셔링원피스,여성의류,원피스,"22,000원",딱한번 입었습니당봄에 입기 딱좋아염급처라 애눌가능해요!교신도 가능 ㅎㅎ사이즈 s,경기도 안양시 만안구 안양9동,중고,6,https://m.bunjang.co.kr/products/152035615?ref=%EC%B9%B4%ED%85%8C%EA%B3%A0%EB%A6%AC%EC%84%A0%ED%83%9D%EA%B2%B0%EA%B3%BC
1286,152036312,1,마쥬 원피스,여성의류,원피스,"55,000원",1회착용,경기도 남양주시 퇴계원면,중고,2,https://m.bunjang.co.kr/products/152036312?ref=%EC%B9%B4%ED%85%8C%EA%B3%A0%EB%A6%AC%EC%84%A0%ED%83%9D%EA%B2%B0%EA%B3%BC
1287,152041259,1,꽈배기 니트 원피스,여성의류,원피스,"13,000원",딱 한번 입었습니다~!오염 하자 없이 깨끗해요사이즈는 프리사이즈입니다,부산광역시 북구 화명제1동,중고,4,https://m.bunjang.co.kr/products/152041259?ref=%EC%B9%B4%ED%85%8C%EA%B3%A0%EB%A6%AC%EC%84%A0%ED%83%9D%EA%B2%B0%EA%B3%BC
1288,152043588,1,에눌o)18ss 온앤온 반셔츠 원피스(55),여성의류,원피스,"50,000원",18ss 온앤온 원피스 55사이즈에요기은세에디션 나올 시즌이여서 옷 라인이 전부 다 이뻐요~ 밑단도 입으면 물결처럼 퍼져서 샤랄라하고 다른 셔츠원피스 보다 더 러블리해보여요총장 92cm 입니다쿨거래시 에눌 가능해요중고거래 특성상 반품&환불 안되요.,경상북도 경산시 서부1동,중고,4,https://m.bunjang.co.kr/products/152043588?ref=%EC%B9%B4%ED%85%8C%EA%B3%A0%EB%A6%AC%EC%84%A0%ED%83%9D%EA%B2%B0%EA%B3%BC
1289,152044103,1,cos 코스 코튼 캉캉스타일 원피스,여성의류,원피스,"43,000원",코튼96% 엘라스틴4%탄성이 좋고 힘 있는 소재입니다(사각리는 재질)밑단 캉캉스타일이 귀여워요벨트별도사이즈표기42/44-55초반가슴단면 44총길이 89,서울특별시 동작구 상도제1동,중고,9,https://m.bunjang.co.kr/products/152044103?ref=%EC%B9%B4%ED%85%8C%EA%B3%A0%EB%A6%AC%EC%84%A0%ED%83%9D%EA%B2%B0%EA%B3%BC
1290,152049505,1,Akke 아케 버클 셔링 원피스,여성의류,원피스,"30,000원",그레이색 롱 원피스고 어디에나 매치하기 좋아요!오염 하자 일절없고 주름도 없어요 뒤에 버클은 조절가능하고 포인트로 너무 예뻐요 사이트에선 품절이고 저렴하게 판매합니다 ,서울특별시 마포구 합정동,중고,5,https://m.bunjang.co.kr/products/152049505?ref=%EC%B9%B4%ED%85%8C%EA%B3%A0%EB%A6%AC%EC%84%A0%ED%83%9D%EA%B2%B0%EA%B3%BC
1291,152049831,1,차이나넥 셔츠원피스,여성의류,원피스,"30,000원",베이지색상 스트라이프 차이나넥 셔츠 원피스새상품 쇼핑몰에서4만원 넘는 상품입니다 무료배송,서울특별시 서초구 양재1동,중고,9,https://m.bunjang.co.kr/products/152049831?ref=%EC%B9%B4%ED%85%8C%EA%B3%A0%EB%A6%AC%EC%84%A0%ED%83%9D%EA%B2%B0%EA%B3%BC
