,img_id,number,title,category_big,category_mid,price,detail,region,status,file_count,url
420,132905614,1,디스코살롱 핑크 원피스,여성의류,원피스,"28,000원",1회착용 후 드라이오염이나 하자 전혀 없음디스코살롱 구매*같이 코디되어있는 가방도 있습니다 혹시 같이 구매의사 있으신분은 말씀해주세요,전국,중고,4,https://m.bunjang.co.kr/products/132905614?ref=%EC%B9%B4%ED%85%8C%EA%B3%A0%EB%A6%AC%EC%84%A0%ED%83%9D%EA%B2%B0%EA%B3%BC
421,132943414,1,색상이예쁜 연보라 롱원피스,여성의류,원피스,"18,000원",새상품 프리사이즈 색상이 너무너무 예쁜제품입니다,인천광역시 중구 신포동,새상품,3,https://m.bunjang.co.kr/products/132943414?ref=%EC%B9%B4%ED%85%8C%EA%B3%A0%EB%A6%AC%EC%84%A0%ED%83%9D%EA%B2%B0%EA%B3%BC
422,133078653,1,미키 스팽글 원피스,여성의류,원피스,"19,000원",스팽글로 미키를 다 박은거라 색감 진짜 예쁨.작은 오염있는데 3번째사진 참고.전체적인 길이는 무릎까지고  양쪽 옆트임 있음.재질이 완전 얇진않아서 속옷 비침은 없지만 옆트임이 신경쓰인다 싶으면 속바지 착용 권함(선택사항).상점에서 2개이상 구매시 택배비 무료♡추천사이즈: free구매가: 4만원대,전국,중고,4,https://m.bunjang.co.kr/products/133078653?ref=%EC%B9%B4%ED%85%8C%EA%B3%A0%EB%A6%AC%EC%84%A0%ED%83%9D%EA%B2%B0%EA%B3%BC
423,133099553,1,자라 투피스,여성의류,원피스,"50,000원",스타일리쉬한 자라 투피스입니다에트로풍 무늬에 파스텔 색감을 자랑하는 하늘하늘 여성스런 옷입니다사이즈 L지만 링클 스타일이라서 아주 프리하게 입으실수 있습니다정가 각각 79000원입니다투피스로 저렴하게 처분합니다쿨 거래시 배송료 쏠께요~,경기도 고양시 일산동구 중산동,새상품,4,https://m.bunjang.co.kr/products/133099553?ref=%EC%B9%B4%ED%85%8C%EA%B3%A0%EB%A6%AC%EC%84%A0%ED%83%9D%EA%B2%B0%EA%B3%BC
424,133104867,1,티렌 스트라이프 원피스6,여성의류,원피스,"30,000원","이사해야해서 옷장 대방출합니다거의 다 새옷이며입었던 옷은 상태 상세히 말씀드려요믿고 거래해주실 분만 연락주시고제 옷 여러개하시면 에눌해드려요^^티렌 스트라이프 원피스 55완전 새옷입으면 핏감이 이쁘고 치마부분 프릴, 자수도 곱네요총장 82택포3만, 반품불가",광주광역시 광산구 수완동,중고,6,https://m.bunjang.co.kr/products/133104867?ref=%EC%B9%B4%ED%85%8C%EA%B3%A0%EB%A6%AC%EC%84%A0%ED%83%9D%EA%B2%B0%EA%B3%BC
425,133105529,1,티렌 원피스9,여성의류,원피스,"30,000원","이사해야해서 옷장 대방출합니다거의 다 새옷이며입었던 옷은 상태 상세히 말씀드려요믿고 거래해주실 분만 연락주시고제 옷 여러개하시면 에눌해드려요^^티렌 레이스 원피스 55완전 새옷투피스 입은것 같은 예쁜 원피스~총장 80택포3만, 반품불가",광주광역시 광산구 수완동,중고,8,https://m.bunjang.co.kr/products/133105529?ref=%EC%B9%B4%ED%85%8C%EA%B3%A0%EB%A6%AC%EC%84%A0%ED%83%9D%EA%B2%B0%EA%B3%BC
426,133105853,1,지컷 g-cut 레이스 와플 원피스,여성의류,원피스,"30,000원",이사해야해서 옷장 대방출합니다거의 다 새옷이며입었던 옷은 상태 상세히 말씀드려요믿고 거래해주실 분만 연락주시고제 옷 여러개하시면 에눌해드려요^^지컷 레이스  원피스 55새옷시스루에 레이스도 한가지가 아니고너무 고급스러워 끝까지 가지고 있었던 원피스에요총장 80택포3만원반품불가,광주광역시 광산구 수완동,중고,8,https://m.bunjang.co.kr/products/133105853?ref=%EC%B9%B4%ED%85%8C%EA%B3%A0%EB%A6%AC%EC%84%A0%ED%83%9D%EA%B2%B0%EA%B3%BC
427,133105968,1,매긴나잇 레이스 원피스,여성의류,원피스,"30,000원","이사해야해서 옷장 대방출합니다거의 다 새옷이며입었던 옷은 상태 상세히 말씀드려요믿고 거래해주실 분만 연락주시고제 옷 여러개하시면 에눌해드려요^^매긴 레이스 원피스 55완전 새옷색상 곱고 레이스 너무 이뻐요. 이너가 붙어있어 비치지 않고,목 부분에 쪼그마한 진주장식이 우아한 느낌총장 80택포3만반품불가",광주광역시 광산구 수완동,중고,8,https://m.bunjang.co.kr/products/133105968?ref=%EC%B9%B4%ED%85%8C%EA%B3%A0%EB%A6%AC%EC%84%A0%ED%83%9D%EA%B2%B0%EA%B3%BC
428,133106621,1,결혼식 원피스,여성의류,원피스,"10,000원",167cm 키에무릎 위정도 올라옵니다,전라북도 전주시 완산구 서신동,중고,1,https://m.bunjang.co.kr/products/133106621?ref=%EC%B9%B4%ED%85%8C%EA%B3%A0%EB%A6%AC%EC%84%A0%ED%83%9D%EA%B2%B0%EA%B3%BC
429,133112097,1,니트미니원피스(무료배송),여성의류,원피스,"10,000원",니트미니원피스입니다.소재가 매우 특이하여 따뜻하게입을수있는 원피스입니다.무료배송이구요.44반~마른55사이즈입기좋습니다.허리부분이 고무줄같이 늘어나서 편하게입기좋습니다,경기도 수원시 영통구 광교1동,중고,3,https://m.bunjang.co.kr/products/133112097?ref=%EC%B9%B4%ED%85%8C%EA%B3%A0%EB%A6%AC%EC%84%A0%ED%83%9D%EA%B2%B0%EA%B3%BC
430,133147764,1,치즈달 체크 원피스 팔아요! 2만3천원,여성의류,원피스,"23,000원",사놓고 한번도 못입었어요! ㅠ 옷장 정리하다가 처분해요! 쿨 거래 시 택포 해드려요!번톡 주세요,서울특별시 강동구 성내제2동,중고,2,https://m.bunjang.co.kr/products/133147764?ref=%EC%B9%B4%ED%85%8C%EA%B3%A0%EB%A6%AC%EC%84%A0%ED%83%9D%EA%B2%B0%EA%B3%BC
431,133169164,1,어몽(among) 뷔스티에 원피스(55-66),여성의류,원피스,"20,000원",구매해서 거의 입지 않아 상태 매우 좋아요블랙처럼 보이지만 빛에따라 살짝 카키 빛이 도는오묘한 색상이라 가을 겨울에 입으시면 예쁘실 거에요총장 100cm중고거래 특성상 반품&환불 안되요.,경상북도 경산시 서부1동,중고,4,https://m.bunjang.co.kr/products/133169164?ref=%EC%B9%B4%ED%85%8C%EA%B3%A0%EB%A6%AC%EC%84%A0%ED%83%9D%EA%B2%B0%EA%B3%BC
432,133238368,1,벨르제이원피스,여성의류,원피스,"13,000원",벨르제이 쇼핑몰에서 구입했는데 저한테 맞지 않아서한번도 안입었어요 완전 새상품입니다2만원에 팔아요 ㅜㅜ,서울특별시 구로구 신도림동,새상품,3,https://m.bunjang.co.kr/products/133238368?ref=%EC%B9%B4%ED%85%8C%EA%B3%A0%EB%A6%AC%EC%84%A0%ED%83%9D%EA%B2%B0%EA%B3%BC
433,133311696,1,valley 원피스,여성의류,원피스,"7,000원",사이즈 : 55-66허리에 끈도 있어서 묶어서 입으면 예뻐요 ❤️연락 주세용 😊(길이 등 자세한 사이즈는 문의 주세요),인천광역시 서구 청라1동,새상품,3,https://m.bunjang.co.kr/products/133311696?ref=%EC%B9%B4%ED%85%8C%EA%B3%A0%EB%A6%AC%EC%84%A0%ED%83%9D%EA%B2%B0%EA%B3%BC
434,133352799,1,"뷔스티에 원피스, 베스트원피스",여성의류,원피스,"5,000원","뷔스티에 조끼 원피스-  사이즈 : 55- 총길이 : 약 87cm- 새상품처럼 깨끗하고 상태 좋습니다.- 반값택배(1,600원) 가능.",부산광역시 남구 문현제1동,중고,2,https://m.bunjang.co.kr/products/133352799?ref=%EC%B9%B4%ED%85%8C%EA%B3%A0%EB%A6%AC%EC%84%A0%ED%83%9D%EA%B2%B0%EA%B3%BC
435,133353160,1,트위드 베스트 원피스,여성의류,원피스,"5,000원","트위드 베스트 원피스- 사이즈 : 55- 총길이 : 약 84cm- 상품 컨디션 깨끗하고 좋습니다.- 흰셔츠와 입으면 고급스러운 하객룩 완성!- 반값택배(1,600원) 가능.",부산광역시 남구 문현제3동,중고,2,https://m.bunjang.co.kr/products/133353160?ref=%EC%B9%B4%ED%85%8C%EA%B3%A0%EB%A6%AC%EC%84%A0%ED%83%9D%EA%B2%B0%EA%B3%BC
436,133366697,1,끌로에 st 쉬폰 원피스,여성의류,원피스,"48,000원",끌로에 모티브 쉬폰 원피스. 새상품디테일이 공임 많이 들어간 디자인총장 92cm,전국,새상품,5,https://m.bunjang.co.kr/products/133366697?ref=%EC%B9%B4%ED%85%8C%EA%B3%A0%EB%A6%AC%EC%84%A0%ED%83%9D%EA%B2%B0%EA%B3%BC
437,133367737,1,프라다 st 실크 원피스,여성의류,원피스,"38,000원","실크100% 플라워 나염원피스. 새상품총장85cm. 허리쪽 밴드채워 원피스나 롱 블라우스로 착용앞부분 염색 나염시 검정부분 살짝 묻어 이염같은부분있음(불량아님, 사진첨부했음)",전국,새상품,4,https://m.bunjang.co.kr/products/133367737?ref=%EC%B9%B4%ED%85%8C%EA%B3%A0%EB%A6%AC%EC%84%A0%ED%83%9D%EA%B2%B0%EA%B3%BC
438,133368708,1,블룸 펄 플리츠 원피스,여성의류,원피스,"94,000원",블룸. 펄 플리츠 원피스. 새제품. 크림컬러은은한 펄감이 있어 고급스럽고 뒷부분 플리츠부분이 여성스러워 보임.소재가 너무 고급스러운 하이퀄리티 제품이에요원단부터 완성도 디자인모두 아주아주 공들인제품입니다,전국,새상품,7,https://m.bunjang.co.kr/products/133368708?ref=%EC%B9%B4%ED%85%8C%EA%B3%A0%EB%A6%AC%EC%84%A0%ED%83%9D%EA%B2%B0%EA%B3%BC
439,133369602,1,엘라 베이지 플레어 원피스,여성의류,원피스,"35,000원","수입의류 쇼핑몰에서 판매되었던 새상품이예요 ^^쇼핑몰 판매가 ₩79,00055사이스 당일발송총길이 92cm폴리에스터 100%직거래 가능, 당일발송상품 발송시 실시간 택배사 운송장 문자 발송타상품교환/반품 가능상품문의, 사이즈문의 등등 언제든 연락주세요. ",서울특별시 구로구 고척제1동,새상품,5,https://m.bunjang.co.kr/products/133369602?ref=%EC%B9%B4%ED%85%8C%EA%B3%A0%EB%A6%AC%EC%84%A0%ED%83%9D%EA%B2%B0%EA%B3%BC
440,133379980,1,산드로 원피스,여성의류,원피스,"75,000원",☆산드로 원피스 새상품☆2사이즈- 55~66 가능☆이쁘게 입으실분 연락 주세요^^,전국,중고,4,https://m.bunjang.co.kr/products/133379980?ref=%EC%B9%B4%ED%85%8C%EA%B3%A0%EB%A6%AC%EC%84%A0%ED%83%9D%EA%B2%B0%EA%B3%BC
441,133403501,1,유럽 빈티지 원피스,여성의류,원피스,"10,000원",빈티지 원피스로 사용감이 있고 작은 얼룩이나 하자가 있을 수 있습니다.오른쪽 어깨 봉제가 살짝 터졌습니다.이 점 감안하고 구매해주세요 :),서울특별시 동작구 상도제1동,중고,4,https://m.bunjang.co.kr/products/133403501?ref=%EC%B9%B4%ED%85%8C%EA%B3%A0%EB%A6%AC%EC%84%A0%ED%83%9D%EA%B2%B0%EA%B3%BC
442,133422217,1,랩 원피스,여성의류,원피스,"15,000원","사이즈-44~66총장-78~82상태-A랩 원피스로 밑에 묶어서 입은 원피스예요~유니크한 디자인으로 섹시하고 꾸안꾸룩, 클럽룩으로 딱이에요!제 키 164로 무릎위 10센치 정도로 예쁜 기장이고 지금 날씨에 입기 좋아용저렴하게 가져가세요쿨거 원함",대구광역시 중구 성내1동,중고,3,https://m.bunjang.co.kr/products/133422217?ref=%EC%B9%B4%ED%85%8C%EA%B3%A0%EB%A6%AC%EC%84%A0%ED%83%9D%EA%B2%B0%EA%B3%BC
443,133452858,1,블룸 트위드콤비원피스,여성의류,원피스,"98,000원",블룸 트위드콤비원피스. 컬러 : 베이지. 새제품도톰한 트위드 원단과 플리츠가 믹스된 매력적인 트위드 원피스.롱기장에 힘이 있는 원단. 떨어지는 라인이 고급스러움.,전국,새상품,8,https://m.bunjang.co.kr/products/133452858?ref=%EC%B9%B4%ED%85%8C%EA%B3%A0%EB%A6%AC%EC%84%A0%ED%83%9D%EA%B2%B0%EA%B3%BC
444,133470149,1,그레이 정장핏 원피스,여성의류,원피스,"15,000원","핫핑 2사이즈(66까지)1회 착용가슴둘레 49cm 총기장 85cm 정도정장핏 원피스 무릎위기장어깨에 패드있음 속치마 있음깔끔하고 예뻐요.색상, 상세사진 참조요망",전국,중고,2,https://m.bunjang.co.kr/products/133470149?ref=%EC%B9%B4%ED%85%8C%EA%B3%A0%EB%A6%AC%EC%84%A0%ED%83%9D%EA%B2%B0%EA%B3%BC
445,133474835,1,오디너리먼트 원피스(베이지),여성의류,원피스,"20,000원",오디너리 원피스 베이지예요새상품입니당!!,전국,새상품,1,https://m.bunjang.co.kr/products/133474835?ref=%EC%B9%B4%ED%85%8C%EA%B3%A0%EB%A6%AC%EC%84%A0%ED%83%9D%EA%B2%B0%EA%B3%BC
446,133499811,1,반팔 배색 니트원피스 (오마이걸 승희 착용),여성의류,원피스,"33,000원","배색 니트 원피스6만원 가까이 주고 구매했는데 나갈일이 없어서 한번도 못입었어요ㅠㅠ사이즈는 M 이고 배색포인트 넘나예쁩니다!오마이걸 승희가 입고나온 옷이에요~택포 33,000원에 팔아요!!",전국,새상품,8,https://m.bunjang.co.kr/products/133499811?ref=%EC%B9%B4%ED%85%8C%EA%B3%A0%EB%A6%AC%EC%84%A0%ED%83%9D%EA%B2%B0%EA%B3%BC
447,133533309,1,롱원피스,여성의류,원피스,"12,000원",‼️특가‼️🟡소재는 린넨입니다🟡린넨 롱원피스이고 랩원피스라 날씬해보여요~~✅배송비+4000원,충청남도 공주시 신관동,중고,6,https://m.bunjang.co.kr/products/133533309?ref=%EC%B9%B4%ED%85%8C%EA%B3%A0%EB%A6%AC%EC%84%A0%ED%83%9D%EA%B2%B0%EA%B3%BC
448,133538294,1,아디다스 면 원피스,여성의류,원피스,"20,000원",키 150후반 기준 무릎 살짝 위에 올라와요! 편하게 입기 좋습니다 ㅎㅎ,전국,중고,5,https://m.bunjang.co.kr/products/133538294?ref=%EC%B9%B4%ED%85%8C%EA%B3%A0%EB%A6%AC%EC%84%A0%ED%83%9D%EA%B2%B0%EA%B3%BC
449,133550917,1,XIX 시스루 블라우스,여성의류,원피스,"10,000원",스타일리쉬한 XIX 호피 패턴 롱블라우스입니다이너탑 셋트로 비침 걱정없이 입으실수 있습니다하늘하늘 여성스럽게 연출하세요보관만 한 새옷입니다,경기도 고양시 일산동구 중산동,새상품,3,https://m.bunjang.co.kr/products/133550917?ref=%EC%B9%B4%ED%85%8C%EA%B3%A0%EB%A6%AC%EC%84%A0%ED%83%9D%EA%B2%B0%EA%B3%BC
450,133672908,1,면 허리 밴딩 롱 원피스,여성의류,원피스,"9,900원","순면 재질의 편하게 입는 롱원피스입니다프리싸이즈(55~66),총장 120 배송받아만 놓구 안입었어요 깨끗한 상태입니다",경기도 시흥시 정왕1동,중고,3,https://m.bunjang.co.kr/products/133672908?ref=%EC%B9%B4%ED%85%8C%EA%B3%A0%EB%A6%AC%EC%84%A0%ED%83%9D%EA%B2%B0%EA%B3%BC
451,133685985,1,클럽모나코 원피스,여성의류,원피스,"30,000원",클럽모나코의 여름원피스에요~ 사이즈는 55입니다^^신축성은 없고요~ H라인이라 허리살 커버하기 좋아요~165이상이 입으시면 무릎위에 적당히 떨어져요^^,경기도 수원시 영통구 영통2동,중고,3,https://m.bunjang.co.kr/products/133685985?ref=%EC%B9%B4%ED%85%8C%EA%B3%A0%EB%A6%AC%EC%84%A0%ED%83%9D%EA%B2%B0%EA%B3%BC
452,133686456,1,임부복66사이즈,여성의류,원피스,"20,000원",나름 백화점에서 산 임부복이에요~ㅋ사이즈는 66인데~ 길이가 길진 않아요~ 바지 입으셔야해요~ 임신해서 차려입고 가야해서 구입했었어요~^^,경기도 수원시 영통구 영통2동,중고,4,https://m.bunjang.co.kr/products/133686456?ref=%EC%B9%B4%ED%85%8C%EA%B3%A0%EB%A6%AC%EC%84%A0%ED%83%9D%EA%B2%B0%EA%B3%BC
453,133712160,1,셔츠원피스,여성의류,원피스,"28,000원","모던로브 하프카라셔링원피스 입니당42000원에 판매되고 있는 원피스고딱 한번 착용했어요~길이감이 저한테는 짧아서 길이 최대한 늘렸어요사이즈 M이구요, 총장 +2cm정도 생각하시면 됩니당",서울특별시 성동구 성수2가제1동,중고,7,https://m.bunjang.co.kr/products/133712160?ref=%EC%B9%B4%ED%85%8C%EA%B3%A0%EB%A6%AC%EC%84%A0%ED%83%9D%EA%B2%B0%EA%B3%BC
454,133734904,1,새거! 프린트 슬림원피스,여성의류,원피스,"10,000원","그냥 새거 입으면 라인 이쁨! 마른분(44,55)이 입으시면 이쁠듯(필자 살쪄서 못입음) ㅜ 보세에서 비싸게 파는 옷이고 지퍼만 봐도 콘솔지퍼라 라인 이쁘게 나옴 ㅜ 재질도 부들 미끌 좋아요 ㅠㅠ♡다른옷도 구경하세요~♡+택포13000",경기도 용인시 기흥구 상하동,중고,4,https://m.bunjang.co.kr/products/133734904?ref=%EC%B9%B4%ED%85%8C%EA%B3%A0%EB%A6%AC%EC%84%A0%ED%83%9D%EA%B2%B0%EA%B3%BC
455,133745574,1,새상품 클럽모나코 원피스,여성의류,원피스,"93,000원","브랜드명: club monaco의류명: Rowlen 드레스성별: 여성계절: 봄, 여름사이즈: 55-66최초판매가: 최소 225,000원구입처: H 패션몰중고여부: 100%새상품택배여부: 가능 흥정여부: 가능사진출처: 골디",서울특별시 송파구 문정2동,새상품,3,https://m.bunjang.co.kr/products/133745574?ref=%EC%B9%B4%ED%85%8C%EA%B3%A0%EB%A6%AC%EC%84%A0%ED%83%9D%EA%B2%B0%EA%B3%BC
456,133927006,1,나시가디건/밴딩반바지 세트,여성의류,원피스,"9,000원",자연스럽게 떨어지는 핏감으로 내추럴한루즈핏나시가디건 밴딩바지 세트,서울특별시 관악구 중앙동,중고,4,https://m.bunjang.co.kr/products/133927006?ref=%EC%B9%B4%ED%85%8C%EA%B3%A0%EB%A6%AC%EC%84%A0%ED%83%9D%EA%B2%B0%EA%B3%BC
457,133934289,1,[새상품]린넨 체크 원피스자켓 세트,여성의류,원피스,"27,000원",시착외 새상품라이브방송으로 구매린넨소재 자세한사이즈는 사진참고저는 44-55입습니다 참고해주세요자켓 원피스 세트입니다구매하실분만 제발 연락주세요~제돈주고 제가산거에여..사업자아닙니당중고상품 특성상 교환 환불 안됩니다!!!제발 매너좀 지켜주세요...저렴하게 올린거라 에눌안됩니다여러개 하시면 에눌해드려용택배는 편의점 택배 +3500원이나 착불채팅 메세지나 hhhaaa22로 카톡주세요,부산광역시 사상구 엄궁동,새상품,9,https://m.bunjang.co.kr/products/133934289?ref=%EC%B9%B4%ED%85%8C%EA%B3%A0%EB%A6%AC%EC%84%A0%ED%83%9D%EA%B2%B0%EA%B3%BC
458,133968731,1,니트 원피스,여성의류,원피스,"15,000원",사고 2번 입은 상품인데 싸게 넘겨요! ,전국,중고,1,https://m.bunjang.co.kr/products/133968731?ref=%EC%B9%B4%ED%85%8C%EA%B3%A0%EB%A6%AC%EC%84%A0%ED%83%9D%EA%B2%B0%EA%B3%BC
459,133983052,1,플라워 원피스(s),여성의류,원피스,"20,700원",저는 주로 44~55입는데약간 할랑하게 맞아요.66초반도 맞을듯여상의 속옷 없이도 티 안나게 입을 수 있어 편합니다.입으면 화사해 보여요상품상태는 좋습니다,서울특별시 용산구 이태원제1동,중고,7,https://m.bunjang.co.kr/products/133983052?ref=%EC%B9%B4%ED%85%8C%EA%B3%A0%EB%A6%AC%EC%84%A0%ED%83%9D%EA%B2%B0%EA%B3%BC
460,134022175,1,SJSJ 원피스 팔아요! 10만원,여성의류,원피스,"100,000원","16년 당시 대구 현대백화점에서 정가로 구입하고 결혼식이나 중요한 자리에만 입고 다녔어요! 옷장 정리하다가 계속 입으려고 했는데 살이 쪄서 안들어가네요,,, 포인트 적립은 번장에 같이 올린 블랙원피스랑 같이 구매해서 합계로 보이는거에요 ! 사이즈는 44 사이즈입니다쿨거래시 무료 배송 해드려요!! 번톡 주세요!",서울특별시 강동구 성내제2동,중고,5,https://m.bunjang.co.kr/products/134022175?ref=%EC%B9%B4%ED%85%8C%EA%B3%A0%EB%A6%AC%EC%84%A0%ED%83%9D%EA%B2%B0%EA%B3%BC
461,134022390,1,SJSJ 원피스 팔아요!! 12만원(가격내려요),여성의류,원피스,"120,000원",16년도에 앞서 올린 분홍 원피스랑 같이 사서 적립금이 합계로 나왔어요!16년 여름에 신상으로 나왔을때 샀습니다!옷장 정리하다가 살이 쪄서 못입고 번장에 내놔요! 사이즈는 44입니다! 쿨거래시 무료 배송해드려요! 번톡 주세요!,서울특별시 강동구 성내제2동,중고,5,https://m.bunjang.co.kr/products/134022390?ref=%EC%B9%B4%ED%85%8C%EA%B3%A0%EB%A6%AC%EC%84%A0%ED%83%9D%EA%B2%B0%EA%B3%BC
462,134072465,1,마가린핑거스 스퀘어 데님 원피스 차콜 흑청 s,여성의류,원피스,"73,900원",스퀘어넥포인트도 너무 예쁘고 허리 잘 잡아줘서 핏도 진짜 예뻐요!! 단추나 워싱 디테일도 섬세하고 넘예쁜데 저랑 안 어울려서 판매합니당.. 완전품절상품이고 매물도 거의없어요ㅠㅠ시착만 잠깐 하고 세탁후 보관중입니당!다른상품도 묶음배송 가능합니다~ 상품 계속 추가해용!,경기도 고양시 일산서구 송포동,중고,4,https://m.bunjang.co.kr/products/134072465?ref=%EC%B9%B4%ED%85%8C%EA%B3%A0%EB%A6%AC%EC%84%A0%ED%83%9D%EA%B2%B0%EA%B3%BC
463,134205367,1,블룸 베이지 카라원피스,여성의류,원피스,"56,000원",블룸 카라원피스. 색상 : 베이지. 새제품A라인 원피스. 목과 팔부분 카라 포인트. 끈을 묶으면 다른 느낌 연출.[ 총장 : 118 (뒷중심) / 가슴 49  / 어깨  38 / 소매 46 ],전국,새상품,7,https://m.bunjang.co.kr/products/134205367?ref=%EC%B9%B4%ED%85%8C%EA%B3%A0%EB%A6%AC%EC%84%A0%ED%83%9D%EA%B2%B0%EA%B3%BC
464,134209367,1,스키니피그 원피스 white blossom,여성의류,원피스,"23,000원","  안어울려서 양도해요사이즈착용만1번 , 새제품이나다름없어요하자없고 보관 비닐에넣어서보관했어요번톡주세여판매가 4.2 >>>>택포 2.3",전국,새상품,4,https://m.bunjang.co.kr/products/134209367?ref=%EC%B9%B4%ED%85%8C%EA%B3%A0%EB%A6%AC%EC%84%A0%ED%83%9D%EA%B2%B0%EA%B3%BC
465,134209670,1,Self portrait 원피스(44~55),여성의류,원피스,"202,500원",제 허리가 24인치인데...아주 딱 맞아요.44~55초반이 맞을듯요디테일이 많은 옷입니다. 짙은 녹색 블라우스와치마가 투피스인듯 하나로 연결된 원피스예요여성스럽고 단아하면서도 섹시한 컨셉인듯요.무릎이 다쳐서 짧은 치마입기에는 좀 그렇고긴 치마는 좀 답답했는데 오늘같은 날씨엔 딱인듯요. 옷 많아서 내놓습니다상태는 좋은편인데 세탁은 함 하셔야 합니당*마지막 이미지 두장은 같은 브랜드 다른 제품인데 참고하시라고 올렸어요,서울특별시 용산구 이태원제2동,중고,8,https://m.bunjang.co.kr/products/134209670?ref=%EC%B9%B4%ED%85%8C%EA%B3%A0%EB%A6%AC%EC%84%A0%ED%83%9D%EA%B2%B0%EA%B3%BC
466,134229927,1,비즈 레이즈 블랙 원피스(66),여성의류,원피스,"35,000원","수입의류 쇼핑몰에서 판매되었던 새상품이예요 ^^66사이즈 당일발송신축성 좋아요총길이 84cm쇼핑몰 판매가 ₩112,000레이스 부분 안감 있습니다.타상품1회교환/반품 가능상품문의, 사이즈문의 등등 언제든 연락주세요. 직거래 가능상품 발송시 실시간 택배사 운송장 문자 발송",서울특별시 구로구 고척제1동,새상품,6,https://m.bunjang.co.kr/products/134229927?ref=%EC%B9%B4%ED%85%8C%EA%B3%A0%EB%A6%AC%EC%84%A0%ED%83%9D%EA%B2%B0%EA%B3%BC
467,134266694,1,가을원피스,여성의류,원피스,"40,000원",맨왼쪽 트렌치원피스랑 회색 풀셋트 트레이닝 셋트팔아요 각각 4만원이에요^ ^,전국,중고,2,https://m.bunjang.co.kr/products/134266694?ref=%EC%B9%B4%ED%85%8C%EA%B3%A0%EB%A6%AC%EC%84%A0%ED%83%9D%EA%B2%B0%EA%B3%BC
468,134344931,1,sm2 셔츠 원피스,여성의류,원피스,"25,000원",,전국,중고,3,https://m.bunjang.co.kr/products/134344931?ref=%EC%B9%B4%ED%85%8C%EA%B3%A0%EB%A6%AC%EC%84%A0%ED%83%9D%EA%B2%B0%EA%B3%BC
469,134357806,1,와인색 목폴라 니트 미니 원피스 556677 교신가능,여성의류,원피스,"8,000원",다리가굵어서입기 부끄럽네용...어울리는분 업어가셔요!비싸게사고 밖에서  한번도 못입고있네요ㅜㅜ많이 안두꺼워서 가을에 입기좋아용쿨거시택포만원이요:),경상북도 칠곡군 북삼읍,중고,2,https://m.bunjang.co.kr/products/134357806?ref=%EC%B9%B4%ED%85%8C%EA%B3%A0%EB%A6%AC%EC%84%A0%ED%83%9D%EA%B2%B0%EA%B3%BC
470,134395251,1,수룩 원피스,여성의류,원피스,"35,000원","수룩 window basic 원피스정가 49,000 현재 품절구입후 1회 착용하고 보관중입니다니트나 가디건이랑 레이어드해서 입으면 이쁠것같아요상태 좋아요!",경상남도 김해시 북부동,중고,3,https://m.bunjang.co.kr/products/134395251?ref=%EC%B9%B4%ED%85%8C%EA%B3%A0%EB%A6%AC%EC%84%A0%ED%83%9D%EA%B2%B0%EA%B3%BC
471,134395412,1,애프터먼데이 원피스,여성의류,원피스,"25,000원",소라그레이 색상 1회 착용 후 색이 안어울려서 판매합니다하자 없고 상태 좋아요!길이가 미디기장이라 바지랑 레이어드 해서 입어도 이뻐요,경상남도 김해시 북부동,중고,2,https://m.bunjang.co.kr/products/134395412?ref=%EC%B9%B4%ED%85%8C%EA%B3%A0%EB%A6%AC%EC%84%A0%ED%83%9D%EA%B2%B0%EA%B3%BC
472,134408141,1,(무료배송) 플라스틱 아일랜드 뷔스티에 원피스,여성의류,원피스,"12,000원",딱 한 번 착용했습니다. 169기준 허벅지 중간보다 살짝 위까지 옵니다. 스타일 바뀌어서 판매해요.,서울특별시 용산구 한강로동,중고,2,https://m.bunjang.co.kr/products/134408141?ref=%EC%B9%B4%ED%85%8C%EA%B3%A0%EB%A6%AC%EC%84%A0%ED%83%9D%EA%B2%B0%EA%B3%BC
473,134430679,1,(새상품)흰색 알로하 미니 원피스,여성의류,원피스,"15,000원",예쁜 흰색 원피스입니다!입고 나간적없는 새상품입니다원래 23000원인데 15000원에 팝니다!!택배는 착불입니다 편의접 반값택배도 가능합니다~!,인천광역시 서구 연희동,중고,2,https://m.bunjang.co.kr/products/134430679?ref=%EC%B9%B4%ED%85%8C%EA%B3%A0%EB%A6%AC%EC%84%A0%ED%83%9D%EA%B2%B0%EA%B3%BC
474,134460336,1,롱원피스,여성의류,원피스,"18,000원",,서울특별시 관악구 신사동,중고,1,https://m.bunjang.co.kr/products/134460336?ref=%EC%B9%B4%ED%85%8C%EA%B3%A0%EB%A6%AC%EC%84%A0%ED%83%9D%EA%B2%B0%EA%B3%BC
